Book Id,Title,Author,Author l-f,Additional Authors,ISBN,ISBN13,My Rating,Average Rating,Publisher,Binding,Number of Pages,Year Published,Original Publication Year,Date Read,Date Added,Bookshelves,Bookshelves with positions,Exclusive Shelf,Read Count
56224080,"Rationality: What It Is, Why It Seems Scarce, Why It Matters",Steven Pinker,"Pinker, Steven",,0241380278,9780241380277,0,3.9,Allen Lane,Hardcover,432,2021,2021,,08-01-22,to-read,to-read (#575),to-read,0
765420,Autobiographies: Charles Darwin,Charles Darwin,"Darwin, Charles","Michael Neve, Sharon Messenger",0140433902,9780140433906,5,3.84,Penguin Classics,paper,128,2002,1887,08-01-22,02-01-22,,,read,1
18521,A Room of One's Own,Virginia Woolf,"Woolf, Virginia",,0141183535,9780141183534,0,4.18,Penguin Books,Paperback,112,2000,1929,,05-01-22,to-read,to-read (#574),to-read,0
37976541,Bad Blood: Secrets and Lies in a Silicon Valley Startup,John Carreyrou,"Carreyrou, John",,152473165X,9781524731656,0,4.38,Knopf Publishing Group,Hardcover,339,2018,2018,,05-01-22,to-read,to-read (#573),to-read,0
26093265,Inheritance,Thomas Wymark,"Wymark, Thomas",,,,0,3.82,Thomas Wymark,Kindle Edition,556,2015,2015,,11-12-21,currently-reading,currently-reading (#2),currently-reading,1
6740213,Natural Experiments of History,Jared Diamond,"Diamond, Jared",James A. Robinson,0674035577,9780674035577,0,3.59,Belknap Press,Hardcover,278,2010,2010,,31-12-21,to-read,to-read (#572),to-read,0
34447296,"Guns, Germs, and Steel: The Fates of Human Societies",Jared Diamond,"Diamond, Jared",,,,5,4.03,W. W. Norton & Company,Kindle Edition,528,2017,1997,31-12-21,05-01-20,,,read,1
196546,The Great Human Diasporas: The History Of Diversity And Evolution,Luigi Luca Cavalli-Sforza,"Cavalli-Sforza, Luigi Luca","Francesco Cavalli-Sforza, Heather Mimnaugh, Sarah Thorne",0201442310,9780201442311,0,4.09,Basic Books,Paperback,320,1996,1995,,31-12-21,to-read,to-read (#571),to-read,0
404414,The History and Geography of Human Genes,Luigi Luca Cavalli-Sforza,"Cavalli-Sforza, Luigi Luca","Paolo Menozzi, Alberto Piazza",0691029059,9780691029054,0,4.34,Princeton University Press,Paperback,432,1996,1994,,31-12-21,to-read,to-read (#570),to-read,0
55277221,When Plants Took Over the Planet: The Amazing Story of Plant Evolution,Chris Thorogood,"Thorogood, Chris",Amy  Grimes,0711261288,9780711261280,0,4.67,QEB Publishing,Hardcover,64,2021,,,27-12-21,to-read,to-read (#569),to-read,0
1698516,Dschungelkind,Sabine Kuegler,"Kuegler, Sabine",,3426778734,9783426778739,0,3.95,Knaur,Paperback,352,2006,2005,,09-12-21,to-read,to-read (#568),to-read,0
35220,The Red Badge of Courage,Stephen Crane,"Crane, Stephen",,1580495869,9781580495868,3,3.29,"Clayton, Del. : Prestwick House Literary Touchstone Classics,",Paperback,149,2006,1895,05-12-21,10-11-21,,,read,1
26953080,Trees at Leisure,Anna Botsford Comstock,"Comstock, Anna Botsford",,1330636600,9781330636602,0,4,Forgotten Books,Paperback,66,2018,2015,,05-12-21,to-read,to-read (#567),to-read,0
660581,The Handbook of Nature Study,Anna Botsford Comstock,"Comstock, Anna Botsford",,0801493846,9780801493843,0,4.34,Cornell University Press,Paperback,912,1986,1911,,05-12-21,to-read,to-read (#566),to-read,0
54326146,A World Without Email: Reimagining Work in an Age of Communication Overload,Cal Newport,"Newport, Cal",,0525536558,9780525536550,0,3.94,Portfolio,Hardcover,320,2021,2021,,29-11-21,to-read,to-read (#565),to-read,0
40672036,Digital Minimalism: Choosing a Focused Life in a Noisy World,Cal Newport,"Newport, Cal",,,,0,4.06,Portfolio,Kindle Edition,302,2019,2019,,29-11-21,to-read,to-read (#564),to-read,0
15801967,Contagious: Why Things Catch On,Jonah Berger,"Berger, Jonah",,1451686579,9781451686579,0,3.96,Simon  Schuster,Hardcover,210,2013,2013,,29-11-21,to-read,to-read (#563),to-read,0
50998942,"Unapologetically Ambitious: Take Risks, Break Barriers, and Create Success on Your Own Terms",Shellye Archambeau,"Archambeau, Shellye",Ben Horowitz,1538702894,9781538702895,0,4.13,Grand Central Publishing,Hardcover,288,2020,2020,,19-11-21,to-read,to-read (#562),to-read,0
38820046,21 Lessons for the 21st Century,Yuval Noah Harari,"Harari, Yuval Noah",,0525512179,9780525512172,0,4.16,Random House,Hardcover,372,2018,2018,,17-11-21,to-read,to-read (#561),to-read,0
40138655,Start Now. Get Perfect Later.,Rob Moore,"Moore, Rob",,,,0,3.59,John Murray,Kindle Edition,208,2018,,,14-11-21,to-read,to-read (#560),to-read,0
125967,Judgment Under Uncertainty: Heuristics and Biases,Daniel Kahneman,"Kahneman, Daniel","Paul Slovic, Amos Tversky",0521284147,9780521284141,0,4.17,Cambridge University Press,Paperback,544,1982,1982,,14-11-21,to-read,to-read (#559),to-read,0
55339408,Noise: A Flaw in Human Judgment,Daniel Kahneman,"Kahneman, Daniel","Olivier Sibony, Cass R. Sunstein",0316451401,9780316451406,0,3.65,"Little, Brown Spark",Hardcover,454,2021,2021,,14-11-21,to-read,to-read (#558),to-read,0
43183121,The Science of Storytelling,Will Storr,"Storr, Will",,,,0,4.09,William Collins,Kindle Edition,144,2019,2019,,08-11-21,to-read,to-read (#557),to-read,0
18594475,Don't Even Think About It: Why Our Brains Are Wired to Ignore Climate Change,George  Marshall,"Marshall, George",,1620401339,9781620401330,5,4.25,Bloomsbury USA,Hardcover,272,2014,2014,07-11-21,17-08-21,,,read,1
25338222,What She Really Wants: A Story,Barbara Delinsky,"Delinsky, Barbara",,,,1,3.71,St. Martin's Press,Kindle Edition,29,2015,2015,07-11-21,07-11-21,,,read,1
855156,"A Most Damnable Invention: Dynamite, Nitrates, and the Making of the Modern World",Stephen R. Bown,"Bown, Stephen R.",,031232913X,9780312329136,0,3.85,Thomas Dunne Books,Hardcover,272,2005,2005,,27-10-21,to-read,to-read (#556),to-read,0
86185,"The 13th Element: The Sordid Tale of Murder, Fire, and Phosphorus",John Emsley,"Emsley, John",,047144149X,9780471441496,0,3.8,Wiley,Paperback,352,2002,2000,,27-10-21,to-read,to-read (#555),to-read,0
56268863,The Book of Hope: A Survival Guide for Trying Times,Jane Goodall,"Goodall, Jane",Douglas Carlton Abrams,1250784093,9781250784094,0,4.28,Celadon Books,Hardcover,272,2021,2021,,24-10-21,to-read,to-read (#554),to-read,0
15799400,The Resurrectionist: The Lost Work of Dr. Spencer Black,E.B. Hudspeth,"Hudspeth, E.B.",,1594746168,9781594746161,0,3.57,Quirk Books,Hardcover,208,2013,2013,,24-10-21,to-read,to-read (#553),to-read,0
34298103,The Science of Screenwriting: The Neuroscience Behind Storytelling Strategies,Paul Gulino,"Gulino, Paul",Connie Shears,1501327240,9781501327247,0,4.27,Bloomsbury Academic,Hardcover,184,2018,,,23-10-21,to-read,to-read (#552),to-read,0
1912586,A Responsibility to Awe: Poems,Rebecca Elson,"Elson, Rebecca",,1903039541,9781903039540,0,4.28,Carcanet Press Ltd.,Paperback,159,2001,2001,,21-10-21,to-read,to-read (#551),to-read,0
84699,"Never Eat Alone: And Other Secrets to Success, One Relationship at a Time",Keith Ferrazzi,"Ferrazzi, Keith",,0385512058,9780385512053,0,3.84,Crown Business,Hardcover,309,2005,2005,,11-10-21,to-read,to-read (#550),to-read,0
665846,"Stop Thinking, Start Living Discover Lifelong Happiness",Richard Carlson,"Carlson, Richard",,0722535473,9780722535479,0,3.98,HarperCollinsPublishers,Paperback,192,1997,1997,,10-10-21,to-read,to-read (#549),to-read,0
55457683,Solving Public Problems: A Practical Guide to Fix Our Government and Change Our World,Beth Simone Noveck,"Noveck, Beth Simone",,030023015X,9780300230154,0,4.29,Yale University Press,Hardcover,448,2021,,,10-10-21,to-read,to-read (#548),to-read,0
56817598,A Bigger Picture: My Fight to Bring a New African Voice to the Climate Crisis,Vanessa Nakate,"Nakate, Vanessa",,0358654505,9780358654506,0,4.38,Mariner Books,Hardcover,240,2021,2021,,07-10-21,to-read,to-read (#547),to-read,0
41957126,Verity,Colleen Hoover,"Hoover, Colleen",,,,0,4.39,"Hoover Ink, Inc.",Kindle Edition,324,2018,2018,,03-10-21,to-read,to-read (#546),to-read,0
34606908,Stop Fixing Women: Why Building Fairer Workplaces Is Everybody's Business,Catherine Fox,"Fox, Catherine",,1742235166,9781742235165,0,4.07,NewSouth,Paperback,272,2017,,,25-09-21,to-read,to-read (#545),to-read,0
51938590,The Book of Eels: Our Enduring Fascination with the Most Mysterious Creature in the Natural World,Patrik Svensson,"Svensson, Patrik",Agnes Broomé,0062968815,9780062968814,0,3.93,Ecco,Hardcover,256,2020,2019,,17-09-21,to-read,to-read (#544),to-read,0
821611,The Story of My Life,Helen Keller,"Keller, Helen",,0553213873,9780553213874,0,4.06,Bantam Classics,Paperback,240,1990,1903,,09-09-21,to-read,to-read (#543),to-read,0
1617,"Night  (The Night Trilogy, #1)",Elie Wiesel,"Wiesel, Elie","Marion Wiesel, François Mauriac",,,0,4.34,Hill & Wang,Paperback,115,2006,1956,,09-09-21,to-read,to-read (#542),to-read,0
33369264,Blackout,Marc Elsberg,"Elsberg, Marc",Marshall Yarbough,1492654418,9781492654414,0,3.97,Sourcebooks Landmark,Hardcover,320,2017,2012,,09-09-21,to-read,to-read (#541),to-read,0
31624481,Drawdown: The Most Comprehensive Plan Ever Proposed to Reverse Global Warming,Paul Hawken,"Hawken, Paul",,0143130447,9780143130444,0,4.43,Penguin Books,Paperback,256,2017,2017,,03-09-21,to-read,to-read (#540),to-read,0
56222243,Built to Belong: Discovering the Power of Community Over Competition,Natalie Franke,"Franke, Natalie",,1546017682,9781546017684,0,4.39,Worthy Books,Hardcover,256,2021,,,25-08-21,to-read,to-read (#539),to-read,0
653396,Feel the Fear and Do It Anyway,Susan  Jeffers,"Jeffers, Susan",,0449902927,9780449902929,0,4.01,Ballantine Books,Paperback,240,1998,1987,,24-08-21,to-read,to-read (#538),to-read,0
97641,Nice Girls Don't Get the Corner Office: 101 Unconscious Mistakes Women Make That Sabotage Their Careers,Lois P. Frankel,"Frankel, Lois P.",,0446693316,9780446693318,0,3.68,Business Plus,Paperback,288,2010,2004,,23-08-21,to-read,to-read (#537),to-read,0
41886488,Xenofeminismo: Tecnologías de género y políticas de reproducción,Helen Hester,"Hester, Helen",Hugo Salas,987162266X,9789871622665,0,3.9,Caja Negra Editora,Paperback,144,2018,2018,,20-08-21,to-read,to-read (#536),to-read,0
45359264,Camera Hunter: George Shiras III and the Birth of Wildlife Photography,James H McCommons,"McCommons, James H",,0826354262,9780826354266,0,4.4,University of New Mexico Press,Hardcover,408,2019,,,17-08-21,to-read,to-read (#535),to-read,0
25422234,Notorious RBG: The Life and Times of Ruth Bader Ginsburg,Irin Carmon,"Carmon, Irin",Shana Knizhnik,0062415832,9780062415837,0,4.15,Dey Street Books,Hardcover,240,2015,2015,,17-08-21,to-read,to-read (#534),to-read,0
54860370,The Life-Changing Science of Detecting Bullshit,John V. Petrocelli,"Petrocelli, John V.",,1250271622,9781250271624,0,3.52,St. Martin's Press,Hardcover,336,2021,2021,,17-08-21,to-read,to-read (#533),to-read,0
10672848,"The Theory That Would Not Die: How Bayes' Rule Cracked the Enigma Code, Hunted Down Russian Submarines, and Emerged Triumphant from Two Centuries of Controversy",Sharon Bertsch McGrayne,"McGrayne, Sharon Bertsch",,0300169698,9780300169690,0,3.75,Yale University Press,Hardcover,336,2011,2011,,17-08-21,to-read,to-read (#532),to-read,0
53238858,"What Happened To You?: Conversations on Trauma, Resilience, and Healing",Bruce D. Perry,"Perry, Bruce D.",Oprah Winfrey,1250223180,9781250223180,0,4.51,Flatiron Books: An Oprah Book,Hardcover,304,2021,2021,,17-08-21,to-read,to-read (#531),to-read,0
57433539,"Unsettled: What Climate Science Tells Us, What It Doesn’t, and Why It Matters",Steven E. Koonin,"Koonin, Steven E.",,,,0,4.38,BenBella Books,Kindle Edition,320,2021,2021,,17-08-21,to-read,to-read (#530),to-read,0
57213320,"Consumed: On Colonialism, Climate Change, Consumerism, and the Need for Collective Change",Aja Barber,"Barber, Aja",,1914240049,9781914240041,0,4.29,Brazen ,Hardcover,288,2021,2021,,16-08-21,to-read,to-read (#529),to-read,0
51199750,"Some Assembly Required: Decoding Four Billion Years of Life, from Ancient Fossils to DNA",Neil Shubin,"Shubin, Neil",,,,0,4.13,Pantheon,Hardcover,267,2020,2020,,13-08-21,to-read,to-read (#528),to-read,0
7990622,The Leafcutter Ants: Civilization by Instinct,Bert Hölldobler,"Hölldobler, Bert",Edward O. Wilson,0393338681,9780393338683,0,4.55,W. W. Norton  Company,Paperback,192,2010,2010,,13-08-21,to-read,to-read (#527),to-read,0
5755,The Language Instinct: How the Mind Creates Language,Steven Pinker,"Pinker, Steven",,0060958332,9780060958336,0,3.98,Harper Perennial Modern Classics,Paperback,448,2000,1994,,13-08-21,to-read,to-read (#526),to-read,0
13593959,A Little History of Science,William Bynum,"Bynum, William",,0300136595,9780300136593,0,3.78,Yale University Press,Hardcover,263,2012,2012,,11-08-21,to-read,to-read (#525),to-read,0
56015023,This Is Your Mind on Plants,Michael Pollan,"Pollan, Michael",,0593296907,9780593296905,0,3.88,Penguin Press,Hardcover,288,2021,2021,,11-08-21,to-read,to-read (#524),to-read,0
58347316,Vaxxers,Sarah Gilbert,"Gilbert, Sarah",Catherine Green,,2100000270163,0,4.5,Hodder & Stoughton,,,2021,,,11-08-21,to-read,to-read (#523),to-read,0
56941534,Our Biggest Experiment: An Epic History of the Climate Crisis,Alice Bell,"Bell, Alice",,1640094334,9781640094338,0,4.24,Counterpoint Press,Hardcover,384,2021,2021,,11-08-21,to-read,to-read (#522),to-read,0
46042395,Say Why to Drugs: Everything You Need to Know About the Drugs We Take and Why We Get High,Suzi Gage,"Gage, Suzi",,1473686229,9781473686229,0,3.97,Hodder  Stoughton,Hardcover,352,2020,,,11-08-21,to-read,to-read (#521),to-read,0
56948247,Handmade: A Scientist’s Search for Meaning through Making,Anna Ploszajski,"Ploszajski, Anna",,,9781472971074,0,4.07,Bloomsbury Publishing Plc (UK & ANZ),Hardcover,,2021,,,11-08-21,to-read,to-read (#520),to-read,0
23054336,"Rafael Carrera and the Emergence of the Republic of Guatemala, 1821-1871",Ralph Lee Woodward  Jr,"Jr, Ralph Lee Woodward",,0820343609,9780820343600,0,4,University of Georgia Press,ebook,648,2012,2014,,10-08-21,to-read,to-read (#519),to-read,0
28512671,"Everybody Lies: Big Data, New Data, and What the Internet Can Tell Us About Who We Really Are",Seth Stephens-Davidowitz,"Stephens-Davidowitz, Seth",Steven Pinker,0062390856,9780062390851,0,3.89,Dey Street Books,Hardcover,338,2017,2017,,09-08-21,to-read,to-read (#518),to-read,0
7968243,Cleopatra: A Life,Stacy Schiff,"Schiff, Stacy",,0316001929,9780316001922,0,3.7,"Little, Brown and Company",Hardcover,369,2010,2010,,09-08-21,to-read,to-read (#517),to-read,0
34684622,Leonardo da Vinci,Walter Isaacson,"Isaacson, Walter",,1501139150,9781501139154,0,4.14,Simon & Schuster,Hardcover,600,2017,2017,,09-08-21,to-read,to-read (#516),to-read,0
53497723,Think and Grow Rich,Napoleon Hill,"Hill, Napoleon",,,,2,4.17,,Kindle Edition,,2020,1937,08-08-21,18-07-21,,,read,1
32056474,The New Wild: Why invasive species will be nature's salvation,Fred Pearce,"Pearce, Fred",,1785780514,9781785780516,4,3.99,Icon Books Ltd,Paperback,352,2016,2015,29-06-21,31-05-21,,,read,1
43726517,Hello World: Being Human in the Age of Algorithms,Hannah Fry,"Fry, Hannah",,0393357368,9780393357363,0,4.14,W. W. Norton  Company,Paperback,256,2019,2018,,02-08-21,to-read,to-read (#515),to-read,0
44286534,You Look Like a Thing and I Love You: How Artificial Intelligence Works and Why It's Making the World a Weirder Place,Janelle Shane,"Shane, Janelle",,0316525243,9780316525244,0,4.19,Voracious,Hardcover,272,2019,2019,,02-08-21,to-read,to-read (#514),to-read,0
55457684,Strange Natures: Conservation in the Era of Synthetic Biology,Kent H. Redford,"Redford, Kent H.",William M. Adams,0300230974,9780300230970,0,4.5,Yale University Press,Hardcover,296,2021,,,30-07-21,to-read,to-read (#513),to-read,0
58158486,"Climate Change Is Racist: Race, Privilege and the Struggle for Climate Justice",Jeremy    Williams,"Williams, Jeremy",Shola Mos-Shogbamimu,1785787756,9781785787751,0,4.28,Icon Books,Paperback,128,2021,2021,,30-07-21,to-read,to-read (#512),to-read,0
55539729,"The Painful Truth: The New Science of Our Aches, Agonies and Afflictions",Monty Lyman,"Lyman, Monty",,1787630544,9781787630543,0,4.22,Bantam Press,Paperback,352,2021,2021,,30-07-21,to-read,to-read (#511),to-read,0
55859958,Getting to the Heart of Science Communication: A Guide to Effective Engagement,Faith Kearns,"Kearns, Faith",,1642830747,9781642830743,0,4.22,Island Press,Paperback,280,2021,,,24-07-21,to-read,to-read (#510),to-read,0
6888126,Old Prague Legends,Magdalena Wagnerová,"Wagnerová, Magdalena",,,,3,3.34,Plot,Hardcover,140,2008,2007,18-07-21,08-07-21,,,read,1
40488122,The Power Of Habit: Why We Do What We Do In Life And Business,Charles Duhigg,"Duhigg, Charles",,,,0,4.11,Random House,Kindle Edition,405,2012,2012,,18-07-21,to-read,to-read (#509),to-read,0
55668918,"Gender Goggles: The Vision You Need to Get Promoted, Strengthen Relationships and Love Graciously",Jill  Eaton,"Eaton, Jill",,,,0,4.83,,Kindle Edition,,2020,,,16-07-21,to-read,to-read (#508),to-read,0
10713286,Outwitting the Devil: The Secret to Freedom and Success,Napoleon Hill,"Hill, Napoleon","Michael Bernard Beckwith, Sharon L. Lechter, Mark Victor Hansen",1402784538,9781402784538,0,4.22,Sterling,Hardcover,288,2011,2011,,06-07-21,to-read,to-read (#507),to-read,0
11709037,"You Are Not So Smart: Why You Have Too Many Friends on Facebook, Why Your Memory Is Mostly Fiction, and 46 Other Ways You're Deluding Yourself",David McRaney,"McRaney, David",,1592406599,9781592406593,0,3.85,Gotham Books,Hardcover,302,2011,2011,,06-07-21,to-read,to-read (#506),to-read,0
291056,Oxygen: The Molecule That Made the World,Nick Lane,"Lane, Nick",,0198607830,9780198607830,0,4.14,"Oxford University Press, USA",Paperback,384,2004,2002,,16-12-20,to-read,to-read (#505),to-read,0
36217531,Beasts at Bedtime: Revealing the Environmental Wisdom in Children’s Literature,Liam Heneghan,"Heneghan, Liam",,022643138X,9780226431383,0,4.27,University of Chicago Press,Hardcover,338,2018,,,06-07-21,to-read,to-read (#504),to-read,0
33785338,Inheritors of the Earth: How Nature Is Thriving in an Age of Extinction,Chris D. Thomas,"Thomas, Chris D.",,1610397274,9781610397278,0,3.98,PublicAffairs,Hardcover,320,2017,2017,,06-07-21,to-read,to-read (#503),to-read,0
40389418,Creativity: Flow and the Psychology of Discovery and Invention,Mihaly Csikszentmihalyi,"Csikszentmihalyi, Mihaly",,,,0,4.08,HarperCollins e-books,Kindle Edition,466,2009,1996,,03-07-21,to-read,to-read (#502),to-read,0
66354,Flow: The Psychology of Optimal Experience,Mihaly Csikszentmihalyi,"Csikszentmihalyi, Mihaly",,0060920432,9780060920432,0,4.08,Harper Perennial,Paperback,303,1990,1990,,03-07-21,to-read,to-read (#501),to-read,0
52644982,Phallacy: Life Lessons from the Animal Penis,Emily Willingham,"Willingham, Emily",,0593087178,9780593087176,0,3.82,Avery Publishing Group,Hardcover,336,2020,2020,,10-06-21,to-read,to-read (#500),to-read,0
25135194,Prisoners of Geography: Ten Maps That Tell You Everything You Need to Know About Global Politics,Tim  Marshall,"Marshall, Tim",,1783961414,9781783961412,3,4.19,Elliott & Thompson,Hardcover,256,2015,2015,31-05-21,06-01-20,,,read,1
54968118,"The Code Breaker: Jennifer Doudna, Gene Editing, and the Future of the Human Race",Walter Isaacson,"Isaacson, Walter",,1982115858,9781982115852,0,4.34,Simon  Schuster,Hardcover,536,2021,2021,,23-05-21,to-read,to-read (#499),to-read,0
10418415,Geek Wisdom: The Sacred Teachings of Nerd Culture,Stephen H. Segal,"Segal, Stephen H.","N.K. Jemisin, Eric San Juan, Genevieve Valentine, Zaki Hasan",1594745277,9781594745270,0,3.56,Quirk Books,Hardcover,223,2011,2011,,18-05-21,to-read,to-read (#498),to-read,0
26114477,The Geek Feminist Revolution,Kameron Hurley,"Hurley, Kameron",,0765386232,9780765386236,0,3.89,Tor Books,Hardcover,272,2016,2016,,18-05-21,to-read,to-read (#497),to-read,0
55145261,The Anthropocene Reviewed,John Green,"Green, John",,0525555218,9780525555216,0,4.46,Dutton,Hardcover,293,2021,2021,,18-05-21,to-read,to-read (#496),to-read,0
43212911,Nerve: Adventures in the Science of Fear,Eva  Holland,"Holland, Eva",,1615196005,9781615196005,0,3.56,The Experiment,Hardcover,256,2020,2020,,18-05-21,to-read,to-read (#495),to-read,0
141624,Napoleon's Buttons: How 17 Molecules Changed History,Penny Le Couteur,"Couteur, Penny Le",Jay Burreson,1585422207,9781585422203,0,3.96,Tarcher,Hardcover,375,2003,1991,,17-05-21,to-read,to-read (#494),to-read,0
55605263,They Say / I Say: The Moves That Matter in Academic Writing,Gerald Graff,"Graff, Gerald",,,,0,3.8,W. W. Norton & Company,ebook,352,,2006,,10-01-21,to-read,to-read (#445),to-read,0
12527,Pilgrim at Tinker Creek,Annie Dillard,"Dillard, Annie",,0072434171,9780072434170,0,4.07,Harper Perennial,Paperback,288,2000,1974,,22-04-21,to-read,to-read (#493),to-read,0
49003616,"A Beautifully Foolish Endeavor (The Carls, #2)",Hank Green,"Green, Hank",,152474347X,9781524743475,0,4.26,Dutton,Hardcover,452,2020,2020,,19-04-21,to-read,to-read (#492),to-read,0
24233708,"An Absolutely Remarkable Thing (The Carls, #1)",Hank Green,"Green, Hank",,,,0,4.03,Dutton,Kindle Edition,343,2018,2018,,19-04-21,to-read,to-read (#491),to-read,0
50403455,Metazoa: Animal Life and the Birth of the Mind,Peter Godfrey-Smith,"Godfrey-Smith, Peter",,0374207941,9780374207946,0,3.91,"Farrar, Straus and Giroux",Hardcover,352,2020,2020,,19-04-21,to-read,to-read (#490),to-read,0
28116739,"Other Minds: The Octopus, the Sea, and the Deep Origins of Consciousness",Peter Godfrey-Smith,"Godfrey-Smith, Peter",,0374227764,9780374227760,0,3.86,"Farrar, Straus and Giroux",Hardcover,257,2016,2016,,19-04-21,to-read,to-read (#489),to-read,0
26085734,"Ctrl, Alt; Delete: How I Grew Up Online",Emma Gannon,"Gannon, Emma",,1785032720,9781785032721,0,3.75,Ebury Press,Paperback,272,2016,2016,,16-04-21,to-read,to-read (#488),to-read,0
3198872,Maria Mitchell and the Sexing of Science: An Astronomer among the American Romantics,Renée Bergland,"Bergland, Renée",,0807021423,9780807021422,0,4.13,Beacon Press,Hardcover,320,2008,2008,,15-04-21,to-read,to-read (#487),to-read,0
52009074,"Charles Darwin’s Barnacle and David Bowie’s Spider: How Scientific Names Celebrate Adventurers, Heroes, and Even a Few Scoundrels",Stephen B. Heard,"Heard, Stephen B.",Emily S. Damstra,0300238282,9780300238280,5,3.74,Yale University Press,Hardcover,256,2020,2020,14-04-21,30-01-20,,,read,1
7170627,The Emperor of All Maladies: A Biography of Cancer,Siddhartha Mukherjee,"Mukherjee, Siddhartha",,,,0,4.28,Scribner,Hardcover,571,2010,2010,,14-04-21,to-read,to-read (#486),to-read,0
44674785,Vanishing Fish: Shifting Baselines and the Future of Global Fisheries,Daniel Pauly,"Pauly, Daniel",Jennifer Jacquet,1771643986,9781771643986,0,4.03,Greystone Books,hardcover,304,2019,,,14-04-21,to-read,to-read (#485),to-read,0
43345615,The Outlaw Ocean: Journeys Across the Last Untamed Frontier,Ian Urbina,"Urbina, Ian",,0451492943,9780451492944,0,4.36,Knopf Publishing Group,Hardcover,560,2019,2019,,11-04-21,to-read,to-read (#484),to-read,0
46002342,"Me and White Supremacy: Combat Racism, Change the World, and Become a Good Ancestor",Layla F. Saad,"Saad, Layla F.",Robin DiAngelo,1728209803,9781728209807,0,4.36,Sourcebooks,Hardcover,238,2020,2020,,06-04-21,to-read,to-read (#483),to-read,0
56026151,The Complete Sherlock Holmes,Arthur Conan Doyle,"Doyle, Arthur Conan",,,,0,4.47,,Kindle Edition,,2020,1927,,23-11-20,currently-reading,currently-reading (#1),currently-reading,1
36978232,The Death of Truth: Notes on Falsehood in the Age of Trump,Michiko Kakutani,"Kakutani, Michiko",,0525574824,9780525574828,0,3.81,Tim Duggan Books,Hardcover,208,2018,2018,,02-04-21,to-read,to-read (#482),to-read,0
54330066,Moving Water: The Everglades and Big Sugar,Amy Green,"Green, Amy",,1421440369,9781421440361,0,4.17,Johns Hopkins University Press,Hardcover,272,2021,,,01-04-21,to-read,to-read (#481),to-read,0
48647498,Useful Delusions: The Power and Paradox of the Self-Deceiving Brain,Shankar Vedantam,"Vedantam, Shankar",Bill Mesler,0393652211,9780393652215,0,3.84,W. W. Norton  Company,ebook,264,2021,2021,,01-04-21,to-read,to-read (#480),to-read,0
55652763,Life After Gravity: Isaac Newton's London Career,Patricia Fara,"Fara, Patricia",,0198841027,9780198841029,0,3.57,"Oxford University Press, USA",Hardcover,288,2021,,,01-04-21,to-read,to-read (#479),to-read,0
41104077,Invisible Women: Data Bias in a World Designed for Men,Caroline Criado Pérez,"Pérez, Caroline Criado",,1419729071,9781419729072,5,4.39,Abrams Press,Hardcover,411,2019,2019,01-04-21,16-02-21,,,read,1
40404801,Notes on a Nervous Planet,Matt Haig,"Haig, Matt",,014313342X,9780143133421,0,4,Penguin Life,Paperback,288,2019,2018,,01-04-21,to-read,to-read (#478),to-read,0
43522601,Do Dice Play God?: The Mathematics of Uncertainty,Ian Stewart,"Stewart, Ian",,1541699475,9781541699472,0,3.71,Basic Books,Hardcover,304,2019,,,01-04-21,to-read,to-read (#477),to-read,0
1804383,El discurso vacío,Mario Levrero,"Levrero, Mario",,9871180292,9789871180295,0,3.88,Interzona,Paperback,144,2006,1996,,27-03-21,to-read,to-read (#476),to-read,0
15843151,"The Science Writers' Handbook: Everything You Need to Know to Pitch, Publish, and Prosper in the Digital Age",Writers of SciLance,"SciLance, Writers of","Thomas Hayden, Michelle Nijhuis",0738216569,9780738216560,0,4.35,Da Capo Lifelong Books,Paperback,320,2013,2013,,26-03-21,to-read,to-read (#475),to-read,0
53404260,Beloved Beasts: Fighting for Life in an Age of Extinction,Michelle Nijhuis,"Nijhuis, Michelle",,1324001682,9781324001683,0,4.12,W. W. Norton  Company,Hardcover,342,2021,2021,,26-03-21,to-read,to-read (#474),to-read,0
18635099,Girl in the Woods: A Memoir,Aspen Matis,"Matis, Aspen",,0062291068,9780062291066,0,3.5,William Morrow,Hardcover,384,2015,2015,,08-03-21,to-read,to-read (#473),to-read,0
42277872,The Garden Jungle: or Gardening to Save the Planet,Dave Goulson,"Goulson, Dave",,1787331350,9781787331358,0,4.4,Jonathan Cape,Hardcover,288,2019,2019,,07-03-21,to-read,to-read (#472),to-read,0
