Book Id,Title,Author,Author l-f,Additional Authors,ISBN,ISBN13,My Rating,Average Rating,Publisher,Binding,Number of Pages,Year Published,Original Publication Year,Date Read,Date Added,Bookshelves,Bookshelves with positions,Exclusive Shelf,Read Count
28186015,Weapons of Math Destruction: How Big Data Increases Inequality and Threatens Democracy,Cathy O'Neil,"O'Neil, Cathy",,0553418815,9780553418811,0,3.88,Crown,Hardcover,259,2016,2016,,04-08-20,to-read,to-read (#369),to-read,0
44770129,"Ultralearning: Master Hard Skills, Outsmart the Competition, and Accelerate Your Career",Scott H. Young,"Young, Scott H.",,,,0,3.92,HarperBusiness,Kindle Edition,304,2019,2019,,04-08-20,to-read,to-read (#368),to-read,0
5546,The Feynman Lectures on Physics,Richard P. Feynman,"Feynman, Richard P.","Robert B. Leighton, Matthew L. Sands",0805390456,9780805390452,0,4.6,Addison Wesley,Hardcover,1552,2005,1964,,03-08-20,to-read,to-read (#367),to-read,0
10261,The Art of Richard P. Feynman,Michelle Feynman,"Feynman, Michelle",,2884490477,9782884490474,0,4.36,Routledge,Hardcover,174,1995,1995,,03-08-20,to-read,to-read (#366),to-read,0
26402816,The Quotable Feynman,Richard P. Feynman,"Feynman, Richard P.","Michelle Feynman, Brian Cox, Yo-Yo Ma",0691153035,9780691153032,0,3.91,Princeton University Press,Hardcover,432,2015,2015,,03-08-20,to-read,to-read (#365),to-read,0
5550,Perfectly Reasonable Deviations from the Beaten Track: Letters of Richard P. Feynman,Richard P. Feynman,"Feynman, Richard P.",Michelle Feynman,0738206369,9780738206363,0,4.25,Basic Books,cloth,512,2005,2004,,03-08-20,to-read,to-read (#364),to-read,0
23500254,"The Power of Vulnerability: Teachings of Authenticity, Connections and Courage",Brené Brown,"Brown, Brené",,,,0,4.56,Sounds True,Audible Audio,1,2013,2013,,02-08-20,to-read,to-read (#363),to-read,0
40109367,Dare to Lead,Brené Brown,"Brown, Brené",,147356252X,9781473562523,0,4.14,Ebury Digital,ebook,332,2018,2018,,02-08-20,to-read,to-read (#362),to-read,0
708271,El Alhajadito,Miguel Ángel Asturias,"Asturias, Miguel Ángel",,9500302071,9789500302074,2,3.36,Losada,Paperback,161,1995,1961,20-07-20,03-07-20,,,read,1
51114529,"Pan-African Social Ecology: Speeches, Conversations, and Essays",Modibo Kadalie,"Kadalie, Modibo",Andrew Zonneveld,0990641880,9780990641889,0,4.31,On Our Own Authority!,Paperback,175,2019,,,07-06-20,to-read,to-read (#361),to-read,0
31621275,Critical Mentoring: A Practical Guide,Torie Weiston-Serdan,"Weiston-Serdan, Torie",Bernadette Sanchez,1620365545,9781620365540,0,3.98,Stylus Publishing (VA),ebook,136,2017,,,05-06-20,to-read,to-read (#360),to-read,0
36687229,Hood Feminism: Notes from the Women That a Movement Forgot,Mikki Kendall,"Kendall, Mikki",,,,0,4.41,Viking,Hardcover,288,2020,2020,,04-06-20,to-read,to-read (#359),to-read,0
635635,"Women, Race & Class",Angela Y. Davis,"Davis, Angela Y.",,0394713516,9780394713519,0,4.55,Vintage,Paperback,271,1983,1981,,02-06-20,to-read,to-read (#358),to-read,0
8171378,The Warmth of Other Suns: The Epic Story of America's Great Migration,Isabel Wilkerson,"Wilkerson, Isabel",,0679444327,9780679444329,0,4.4,Random House,Hardcover,622,2010,2010,,02-06-20,to-read,to-read (#357),to-read,0
26073085,White Rage: The Unspoken Truth of Our Racial Divide,Carol  Anderson,"Anderson, Carol",,1632864126,9781632864123,0,4.48,Bloomsbury USA,Hardcover,256,2016,2016,,01-06-20,to-read,to-read (#356),to-read,0
696116,Living on the Wind: Across the Hemisphere with Migratory Birds,Scott Weidensaul,"Weidensaul, Scott",,0865475911,9780865475915,0,4.4,North Point Press,Paperback,432,2000,1999,,01-06-20,to-read,to-read (#355),to-read,0
17573681,Spillover: Animal Infections and the Next Human Pandemic,David Quammen,"Quammen, David",,0393346617,9780393346619,0,4.4,W. W. Norton  Company,Paperback,592,2013,2012,,01-06-20,to-read,to-read (#354),to-read,0
34181487,White Like Her: My Family's Story of Race and Racial Passing,Gail Lukasik,"Lukasik, Gail",Kenyatta Berry,1510724125,9781510724129,0,3.71,Skyhorse,Hardcover,316,2017,2017,,01-06-20,to-read,to-read (#353),to-read,0
76401,Bury My Heart at Wounded Knee: An Indian History of the American West,Dee Brown,"Brown, Dee",,0805066691,9780805066692,0,4.19,"Henry Holt and Company, LLC",Paperback,509,2001,1970,,29-05-20,to-read,to-read (#352),to-read,0
7604,Lolita,Vladimir Nabokov,"Nabokov, Vladimir",Craig Raine,,,0,3.88,Penguin,Paperback,331,1995,1955,,15-05-20,to-read,to-read (#351),to-read,0
7603,Reading Lolita in Tehran: A Memoir in Books,Azar Nafisi,"Nafisi, Azar",,081297106X,9780812971064,0,3.62,Random House Trade Paperbacks,Paperback,356,2003,2003,,15-05-20,to-read,to-read (#350),to-read,0
11135059,A New System of Chemical Philosophy,John Dalton,"Dalton, John",,1108019684,9781108019682,0,3.33,Cambridge University Press,Paperback,376,2010,1953,,11-05-20,to-read,to-read (#349),to-read,0
99629,The Malay Archipelago,Alfred Russel Wallace,"Wallace, Alfred Russel",,9625936459,9789625936451,0,4.19,Periplus Editions,Paperback,544,2000,1869,,11-05-20,to-read,to-read (#348),to-read,0
13330929,"On a Farther Shore: The Life and Legacy of Rachel Carson, Author of Silent Spring",William Souder,"Souder, William",,030746220X,9780307462206,0,3.91,Crown,Hardcover,512,2012,2012,,11-05-20,to-read,to-read (#347),to-read,0
50881189,On the Connexion of the Physical Sciences,Mary Fairfax Somerville Johnston,"Johnston, Mary Fairfax Somerville",,,,0,0,Library of Alexandria,Kindle Edition,552,2016,,,11-05-20,to-read,to-read (#346),to-read,0
984782,"Sidereus Nuncius, or The Sidereal Messenger",Galileo Galilei,"Galilei, Galileo",Albert van Helden,0226279030,9780226279039,0,3.93,University Of Chicago Press,Paperback,135,1989,1610,,11-05-20,to-read,to-read (#345),to-read,0
51810299,La casa de Bernarda Alba,Federico García Lorca,"Lorca, Federico García",,,,4,3.83,,Kindle Edition,115,2019,1945,,18-01-20,,,read,1
17707988,"Why Dogs Hump and Bees Get Depressed: The Fascinating Science of Animal Intelligence, Emotions, Friendship, and Conservation",Marc Bekoff,"Bekoff, Marc",,1608682196,9781608682195,0,3.28,New World Library,Paperback,400,2013,2013,,30-04-20,to-read,to-read (#344),to-read,0
382167,"Crimes Against Nature: Squatters, Poachers, Thieves, and the Hidden History of American Conservation",Karl Jacoby,"Jacoby, Karl",,0520239091,9780520239098,0,4.12,University of California Press,Paperback,324,2003,2001,,30-04-20,to-read,to-read (#343),to-read,0
38740747,The Snow Leopard Project: And Other Adventures in Warzone Conservation,Alex Dehgan,"Dehgan, Alex",,1610396952,9781610396950,0,4.03,PublicAffairs,Hardcover,288,2019,2019,,30-04-20,to-read,to-read (#342),to-read,0
34524450,The Lost Species: Great Expeditions in the Collections of Natural History Museums,Christopher Kemp,"Kemp, Christopher",,022638621X,9780226386218,0,4.04,University of Chicago Press,Hardcover,256,2017,,,30-04-20,to-read,to-read (#341),to-read,0
25330069,Socialism . . . Seriously: A Brief Guide to Human Liberation,Danny Katch,"Katch, Danny",,1608465152,9781608465156,0,3.95,Haymarket Books,Paperback,182,2015,2015,,27-04-20,to-read,to-read (#340),to-read,0
29780253,Born a Crime: Stories From a South African Childhood,Trevor Noah,"Noah, Trevor",,0385689225,9780385689229,0,4.46,Doubleday Canada,Hardcover,289,2016,2016,,14-04-20,to-read,to-read (#339),to-read,0
162780,What Is Life? with Mind and Matter and Autobiographical Sketches,Erwin Schrödinger,"Schrödinger, Erwin",Roger Penrose,0521427088,9780521427081,0,4.15,Cambridge University Press,Paperback,184,1992,1944,,14-04-20,to-read,to-read (#338),to-read,0
10596103,The Filter Bubble: What the Internet is Hiding From You,Eli Pariser,"Pariser, Eli",,1594203008,9781594203008,0,3.79,Penguin Press,Hardcover,294,2011,2011,,14-04-20,to-read,to-read (#337),to-read,0
50254902,Ensayo Sobre La Ceguera,José Saramago,"Saramago, José",,,,0,4.15,Aguilar Chilena de Ediciones S.A,Paperback,366,2014,1995,,05-02-20,to-read,to-read (#298),to-read,0
29940806,Next Gen PhD: A Guide to Career Paths in Science,Melanie V. Sinche,"Sinche, Melanie V.",,0674504658,9780674504653,0,4.13,Harvard University Press,Hardcover,272,2016,,,08-04-20,to-read,to-read (#336),to-read,0
25622872,Half-Earth: Our Planet's Fight for Life,Edward O. Wilson,"Wilson, Edward O.",,1631490826,9781631490828,0,3.93,Liveright,Hardcover,272,2016,2016,,08-04-20,to-read,to-read (#335),to-read,0
39383444,The Great Tree of Life,Douglas Soltis,"Soltis, Douglas",Pamela Soltis,0128125535,9780128125533,0,0,Academic Press,Paperback,184,2018,,,31-03-20,to-read,to-read (#334),to-read,0
52500766,Consider This: Moments in My Writing Life After Which Everything Was Different,Chuck Palahniuk,"Palahniuk, Chuck",,1538717956,9781538717950,0,4.39,Grand Central Publishing,Hardcover,256,2020,2020,,07-01-20,to-read,to-read (#87),to-read,0
30231743,Are We Smart Enough to Know How Smart Animals Are?,Frans de Waal,"Waal, Frans de",,0393353664,9780393353662,0,3.91,W. W. Norton  Company,Paperback,275,2017,2016,,15-03-20,to-read,to-read (#333),to-read,0
52298944,El señor presidente,Miguel Ángel Asturias,"Asturias, Miguel Ángel",,8447308367,9788447308361,5,3.98,RBA.,Paperback,286,,1946,01-01-08,05-01-20,,,read,1
22609341,Come as You Are: The Surprising New Science that Will Transform Your Sex Life,Emily Nagoski,"Nagoski, Emily",,1476762090,9781476762098,0,4.27,Simon  Schuster,Paperback,400,2015,2015,,11-03-20,to-read,to-read (#332),to-read,0
33295210,I Contain Multitudes: The Microbes Within Us and a Grander View of Life,Ed Yong,"Yong, Ed",,1784700177,9781784700171,5,4.12,Vintage,Paperback,354,2017,2016,26-02-20,05-01-20,,,read,1
669780,Season of Migration to the North,Tayeb Salih,"Salih, Tayeb","Denys Johnson-Davies, الطيب صالح",0435900668,9780435900663,0,3.7,Heinemann,Paperback,176,1970,1966,,06-03-20,to-read,to-read (#331),to-read,0
6080337,"The Year of the Flood (MaddAddam, #2)",Margaret Atwood,"Atwood, Margaret",,0385528779,9780385528771,0,4.03,Doubleday Nan A. Talese,Hardcover,431,2009,2009,,05-03-20,to-read,to-read (#330),to-read,0
53447,El túnel,Ernesto Sabato,"Sabato, Ernesto",Nino Pipia,9871144261,9789871144266,5,4.04,Booket,Paperback,158,2003,1948,01-01-09,05-01-20,favorites,favorites (#6),read,4
1641324,El Hombre Que Calculaba,Malba Tahan,"Tahan, Malba",,9681820932,9789681820930,5,4.11,Editorial Limusa,Pasta blanda,226,2014,1938,01-01-06,10-01-20,favorites,favorites (#3),read,1
269322,The Raven and Other Poems,Edgar Allan Poe,"Poe, Edgar Allan",Philip Pullman,0439224063,9780439224062,5,4.3,Scholastic Paperbacks,Paperback,73,2002,1845,01-01-08,12-01-20,favorites,favorites (#1),read,1
391729,The Tell-Tale Heart and Other Writings,Edgar Allan Poe,"Poe, Edgar Allan",,0553212281,9780553212280,5,4.18,Bantam Classics,Mass Market Paperback,448,2004,1843,01-01-09,12-01-20,favorites,favorites (#2),read,1
61773,La colmena,Camilo José Cela,"Cela, Camilo José",,8420634395,9788420634395,4,3.76,Alianza,Paperback,336,1992,1951,01-01-09,12-01-20,,,read,1
252577,"Angela's Ashes (Frank McCourt, #1)",Frank McCourt,"McCourt, Frank",,0007205236,9780007205233,5,4.12,Harper Perennial,Paperback,452,2005,1996,01-01-08,05-01-20,favorites,favorites (#10),read,1
2657,To Kill a Mockingbird,Harper Lee,"Lee, Harper",,,,5,4.27,Harper Perennial Modern Classics ,Paperback,336,2006,1960,01-01-07,05-01-20,favorites,favorites (#9),read,1
4005310,Why Evolution Is True,Jerry A. Coyne,"Coyne, Jerry A.",,0670020532,9780670020539,5,4.18,Viking,Hardcover,282,2009,2008,01-01-12,05-01-20,favorites,favorites (#8),read,1
5129,Brave New World,Aldous Huxley,"Huxley, Aldous",,0060929871,9780060929879,5,3.99,HarperPerennial / Perennial Classics,Paperback,268,1998,1932,01-01-09,05-01-20,favorites,favorites (#7),read,1
40098633,Don't Be Such a Scientist: Talking Substance in an Age of Style,Randy Olson,"Olson, Randy",,,,5,3.74,Island Press,Kindle Edition,248,2018,2009,01-11-19,05-01-20,favorites,favorites (#5),read,1
62539,The Creation: An Appeal to Save Life on Earth,Edward O. Wilson,"Wilson, Edward O.",,0393062171,9780393062175,5,4.03,W. W. Norton  Company,Hardcover,192,2006,2006,01-01-14,07-01-20,favorites,favorites (#4),read,1
44153387,The Feather Thief,Kirk Wallace Johnson,"Johnson, Kirk Wallace",,1101981636,9781101981634,5,4.02,Penguin Books,Paperback,336,2019,2018,15-01-20,07-01-20,,,read,1
4471828,Maasai: People of Cattle,David      Anderson,"Anderson, David",,0811808319,9780811808316,5,4.2,Chronicle Books,Hardcover,61,1995,,,25-02-20,,,read,1
51633114,Branding Quickies: A Collection from 20 Women Killing it in the Branding Game,Kay Kingsman,"Kingsman, Kay","Andrea Valeria, Kiona P",0999694995,9780999694992,0,0,Blank Room,Paperback,110,2019,,,14-01-20,to-read,to-read (#151),to-read,0
51274206,The Future of Feeling: Building Empathy in a Tech-Obsessed World,Kaitlin Ugolik Phillips,"Phillips, Kaitlin Ugolik",,,,0,3.19,Little A,Kindle Edition,223,2020,2020,,14-02-20,to-read,to-read (#328),to-read,0
30231729,The Death and Life of the Great Lakes,Dan Egan,"Egan, Dan",,0393246434,9780393246438,0,4.34,W. W. Norton  Company,Hardcover,364,2017,2017,,14-02-20,to-read,to-read (#329),to-read,0
91262,What Is Life?,Lynn Margulis,"Margulis, Lynn",Dorion Sagan,0520220218,9780520220218,0,4.37,University of California Press,Paperback,288,2000,1995,,11-02-20,to-read,to-read (#327),to-read,0
22856166,Headstrong: 52 Women Who Changed Science-and the World,Rachel Swaby,"Swaby, Rachel",,0553446797,9780553446791,0,3.99,Broadway Books,Paperback,288,2015,2015,,11-02-20,to-read,to-read (#326),to-read,0
2904174,Curious Bones: Mary Anning and the Birth of Paleontology,Thomas W. Goodhue,"Goodhue, Thomas W.",,1883846935,9781883846930,0,3.71,Morgan Reynolds Publishing,Library Binding,112,2002,2002,,11-02-20,to-read,to-read (#325),to-read,0
32283,Africa in My Blood: An Autobiography in Letters,Jane Goodall,"Goodall, Jane",Dale Peterson,0395854040,9780395854044,0,4.04,Houghton Mifflin Harcourt,Hardcover,400,2000,2000,,11-02-20,to-read,to-read (#324),to-read,0
6472839,The Madame Curie Complex: The Hidden History of Women in Science,Julie Des Jardins,"Jardins, Julie Des",,1558616136,9781558616134,0,3.85,Feminist Press,Paperback,312,2010,2010,,11-02-20,to-read,to-read (#323),to-read,0
79664,Chrysalis: Maria Sibylla Merian and the Secrets of Metamorphosis,Kim Todd,"Todd, Kim",,0151011087,9780151011087,0,3.87,Houghton Mifflin Harcourt,Hardcover,328,2007,2007,,11-02-20,to-read,to-read (#322),to-read,0
400065,Hypatia of Alexandria,Maria Dzielska,"Dzielska, Maria",F. Lyra,0674437764,9780674437760,0,3.68,Harvard University Press,Paperback,176,1996,1993,,11-02-20,to-read,to-read (#321),to-read,0
16002028,"Primates: The Fearless Science of Jane Goodall, Dian Fossey, and Biruté Galdikas",Jim Ottaviani,"Ottaviani, Jim",Maris Wicks,1596438657,9781596438651,0,3.84,First Second,Hardcover,144,2013,2013,,11-02-20,to-read,to-read (#320),to-read,0
1215739,Lise Meitner: A Life in Physics,Ruth Lewin Sime,"Sime, Ruth Lewin",,0520208609,9780520208605,0,4.31,University of California Press,Paperback,540,1997,1996,,11-02-20,to-read,to-read (#319),to-read,0
135486,In the Shadow of Man,Jane Goodall,"Goodall, Jane","Hugo van Lawick, David A. Hamburg",0618056769,9780618056767,0,4.36,Mariner Books,Paperback,297,2000,1971,,11-02-20,to-read,to-read (#318),to-read,0
459134,Obsessive Genius: The Inner World of Marie Curie,Barbara Goldsmith,"Goldsmith, Barbara",,0393327485,9780393327489,5,4.04,W. W. Norton  Company,Paperback,272,2005,2005,,11-02-20,,,read,1
149285,"Nobel Prize Women in Science: Their Lives, Struggles, and Momentous Discoveries",Sharon Bertsch McGrayne,"McGrayne, Sharon Bertsch",National Academy of Sciences,0309072700,9780309072700,0,4.26,Joseph Henry Press,Paperback,472,2001,1993,,11-02-20,to-read,to-read (#317),to-read,0
40653150,Superheavy: Making and Breaking the Periodic Table,Kit  Chapman,"Chapman, Kit",,1472953894,9781472953896,0,4.28,Bloomsbury SIGMA,Hardcover,304,2019,,,11-02-20,to-read,to-read (#316),to-read,0
23396040,Ada's Algorithm: How Lord Byron's Daughter Ada Lovelace Launched the Digital Age,James Essinger,"Essinger, James",,,,0,3.27,Melville House,Kindle Edition,272,2014,2013,,11-02-20,to-read,to-read (#315),to-read,0
38509968,Forgotten Women: The Writers (Forgotten Women),Zing Tsjeng,"Tsjeng, Zing",,178840064X,9781788400640,0,4.3,Cassell,Hardcover,224,2018,,,11-02-20,to-read,to-read (#314),to-read,0
35960265,Forgotten Women: The Scientists (Forgotten Women),Zing Tsjeng,"Tsjeng, Zing",,1844039838,9781844039838,0,4.15,Cassell,Hardcover,224,2018,2018,,11-02-20,to-read,to-read (#313),to-read,0
15892127,Sex at Dusk: Lifting the Shiny Wrapping from Sex at Dawn,Lynn Saxon,"Saxon, Lynn",,1477697284,9781477697283,0,3.83,Createspace Independent Publishing Platform,Paperback,376,2012,2012,,09-02-20,to-read,to-read (#312),to-read,0
764783,The Myth of Monogamy: Fidelity and Infidelity in Animals and People,David Philip Barash,"Barash, David Philip",Judith Eve Lipton,0805071369,9780805071368,0,3.75,Holt Paperbacks,Paperback,240,2002,2001,,09-02-20,to-read,to-read (#311),to-read,0
6340873,The Evolution of God,Robert Wright,"Wright, Robert",,0316734918,9780316734912,0,3.94,"Little, Brown and Company",Hardcover,567,2009,2009,,09-02-20,to-read,to-read (#310),to-read,0
32610,On the Shoulders of Giants: The Great Works of Physics and Astronomy,Stephen Hawking,"Hawking, Stephen",,0762427329,9780762427321,0,4.2,Penguin Books,Paperback,256,2006,2002,,09-02-20,to-read,to-read (#309),to-read,0
40611510,The Last Lecture,Randy Pausch,"Pausch, Randy",Jeffrey Zaslow,,,0,4.23,Hachette Books,Kindle Edition,217,2008,2008,,09-02-20,to-read,to-read (#308),to-read,0
38447,"The Handmaid's Tale (The Handmaid's Tale, #1)",Margaret Atwood,"Atwood, Margaret",,,,0,4.12,Anchor Books,Paperback,314,1998,1985,,09-02-20,to-read,to-read (#307),to-read,0
130580,Old Yeller,Fred Gipson,"Gipson, Fred",,0060935472,9780060935474,0,4.08,Harper Perennial Modern Classics,Paperback,132,2001,1958,,09-02-20,to-read,to-read (#306),to-read,0
2175,Madame Bovary,Gustave Flaubert,"Flaubert, Gustave","Mark Overstall, Malcolm Bowie, Margaret Mauldon",0192840398,9780192840394,0,3.69,Oxford University Press,Paperback,329,2004,1856,,09-02-20,to-read,to-read (#305),to-read,0
18932822,The Advance of Science in the Last Half-Century,Thomas Henry Huxley,"Huxley, Thomas Henry",,,,0,3.33,,Kindle Edition,112,2012,,,09-02-20,to-read,to-read (#304),to-read,0
119694,Evolution and Ethics Science and Morals,Thomas Henry Huxley,"Huxley, Thomas Henry",,159102126X,9781591021261,0,3.79,Prometheus Books,Paperback,151,2004,1970,,09-02-20,to-read,to-read (#303),to-read,0
30565,Man's Place in Nature,Thomas Henry Huxley,"Huxley, Thomas Henry",,0486432734,9780486432731,0,3.82,Dover Publications,Paperback,192,2003,1863,,09-02-20,to-read,to-read (#302),to-read,0
393510,Problems of Relative Growth,Julian Huxley,"Huxley, Julian",Frederick B. Churchill,0801846595,9780801846595,0,4,Johns Hopkins University Press,Paperback,360,1993,1972,,09-02-20,to-read,to-read (#301),to-read,0
30559,Aldous Huxley: A Biography,Sybille Bedford,"Bedford, Sybille",,1566634547,9781566634540,0,3.99,Ivan R. Dee Publisher,Paperback,769,2002,1973,,09-02-20,to-read,to-read (#300),to-read,0
30561,Ape and Essence,Aldous Huxley,"Huxley, Aldous",,0929587782,9780929587783,0,3.76,Ivan R. Dee Publisher,Paperback,222,1992,1948,,09-02-20,to-read,to-read (#299),to-read,0
34757361,The Rise of Yeast: How the Sugar Fungus Shaped Civilization,Nicholas P. Money,"Money, Nicholas P.",,0190270713,9780190270711,0,3.57,"Oxford University Press, USA",Hardcover,224,2018,2017,,03-02-20,to-read,to-read (#297),to-read,0
232577,Gorillas in the Mist,Dian Fossey,"Fossey, Dian",,061808360X,9780618083602,0,4.11,Mariner Books,Paperback,326,2000,1983,,02-02-20,to-read,to-read (#296),to-read,0
23013953,Gut: The Inside Story of Our Body’s Most Underrated Organ,Giulia Enders,"Enders, Giulia",Jill Enders,1771641495,9781771641494,0,4.04,Greystone Books,Paperback,273,2015,2014,,01-02-20,to-read,to-read (#295),to-read,0
8049273,"The Elegant Universe: Superstrings, Hidden Dimensions, and the Quest for the Ultimate Theory",Brian Greene,"Greene, Brian",,039333810X,9780393338102,0,4.07,W. W. Norton & Company,Paperback,464,2010,1999,,01-02-20,to-read,to-read (#294),to-read,0
8520362,The Grand Design,Stephen Hawking,"Hawking, Stephen",Leonard Mlodinow,0553805371,9780553805376,0,4.04,Bantam,Hardcover,199,2010,2010,,01-02-20,to-read,to-read (#293),to-read,0
18405,Gone with the Wind,Margaret Mitchell,"Mitchell, Margaret",,0446675539,9780446675536,0,4.3,Warner Books,Mass Market Paperback,1037,1999,1936,,01-02-20,to-read,to-read (#292),to-read,0
5,"Harry Potter and the Prisoner of Azkaban (Harry Potter, #3)",J.K. Rowling,"Rowling, J.K.",Mary GrandPré,043965548X,9780439655484,3,4.57,Scholastic Inc.,Mass Market Paperback,435,2004,1999,,01-02-20,,,read,1
40961427,1984,George Orwell,"Orwell, George",,,,0,4.19,Houghton Mifflin Harcourt,Kindle Edition,298,2013,1949,,01-02-20,to-read,to-read (#291),to-read,0
12296,The Scarlet Letter,Nathaniel Hawthorne,"Hawthorne, Nathaniel","Thomas E. Connolly, Nina Baym",0142437263,9780142437261,0,3.42,Penguin Books,Paperback,279,2003,1850,,01-02-20,to-read,to-read (#290),to-read,0
2932,"Robinson Crusoe (Robinson Crusoe, #1)",Daniel Defoe,"Defoe, Daniel","Virginia Woolf, Franciszek Mirandola, Samuli Suomalainen",,,0,3.68,Modern Library,Paperback,320,2001,1719,,25-01-20,to-read,to-read (#273),to-read,0
859858,Round River,Aldo Leopold,"Leopold, Aldo",,0195015630,9780195015638,0,4.26,"Oxford University Press, USA",Paperback,286,1972,1972,,31-01-20,to-read,to-read (#289),to-read,0
210404,A Sand County Almanac and Sketches Here and There,Aldo Leopold,"Leopold, Aldo",,0195007778,9780195007770,0,4.28,"Oxford University Press, USA",Paperback,269,1968,1949,,31-01-20,to-read,to-read (#288),to-read,0
27311903,The Scientist's Guide to Writing: How to Write More Easily and Effectively Throughout Your Scientific Career,Stephen B. Heard,"Heard, Stephen B.",,0691170223,9780691170220,0,4.45,Princeton University Press,Paperback,316,2016,2016,,30-01-20,to-read,to-read (#287),to-read,0
1292585,Unfinished Conquest: The Guatemalan Tragedy,Victor Perera,"Perera, Victor",,0520203496,9780520203495,0,3.92,University of California Press,Paperback,297,1995,1993,,25-01-20,to-read,to-read (#286),to-read,0
1128079,The Last Lords of Palenque: The Lacandon Mayas of the Mexican Rain Forest,Victor Perera,"Perera, Victor",,0520053095,9780520053090,0,3.82,University of California Press,Paperback,320,1986,1986,,25-01-20,to-read,to-read (#285),to-read,0
20651507,Imitación de Guatemala,Rodrigo Rey Rosa,"Rosa, Rodrigo Rey",,,9788420414973,0,3.85,Alfaguara,Paperback,368,2013,2008,,25-01-20,to-read,to-read (#284),to-read,0
964057,Las venas abiertas de América Latina,Eduardo Galeano,"Galeano, Eduardo",,9682319005,9789682319006,0,4.29,Siglo XXI Ediciones,Paperback,470,1994,1971,,25-01-20,to-read,to-read (#283),to-read,0
2104372,El descubrimiento de América que todavía no fue y nuevos ensayos (Colección Trópicos 33),Eduardo Galeano,"Galeano, Eduardo",,9806273230,9789806273238,0,4.2,Alfadil Ediciones (Caracas),,187,1991,1986,,25-01-20,to-read,to-read (#282),to-read,0
29806891,El cazador de historias,Eduardo Galeano,"Galeano, Eduardo",,,,0,4.05,Siglo XXI Editores,Kindle Edition,,2016,2014,,25-01-20,to-read,to-read (#281),to-read,0
102729,Bitter Fruit: The Story of the American Coup in Guatemala,Stephen C. Schlesinger,"Schlesinger, Stephen C.",Stephen Kinzer,067401930X,9780674019300,0,4.26,David Rockefeller Center for Latin American Studies,Paperback,374,2005,1982,,25-01-20,to-read,to-read (#280),to-read,0
9247128,"3,096 Days",Natascha Kampusch,"Kampusch, Natascha",Jill Kreuer,0670919993,9780670919994,0,3.92,Penguin Books,Paperback,240,2010,2010,,25-01-20,to-read,to-read (#279),to-read,0
29072594,Born to Run,Bruce Springsteen,"Springsteen, Bruce",,1501141511,9781501141515,0,4.12,Simon  Schuster,Hardcover,528,2016,2016,,25-01-20,to-read,to-read (#278),to-read,0
23995249,The Invention of Nature: Alexander von Humboldt's New World,Andrea Wulf,"Wulf, Andrea",,038535066X,9780385350662,0,4.21,Knopf,Hardcover,473,2015,2015,,25-01-20,to-read,to-read (#277),to-read,0
9553383,A History of the World in 100 Objects,Neil MacGregor,"MacGregor, Neil",,1846144132,9781846144134,0,4.2,Allen Lane,Hardcover,707,2010,2010,,25-01-20,to-read,to-read (#276),to-read,0
18669169,The Sleepwalkers: How Europe Went to War in 1914,Christopher   Clark,"Clark, Christopher",,,,0,4.18,Penguin,Kindle Edition,682,2012,2012,,25-01-20,to-read,to-read (#275),to-read,0
642231,Measuring the World,Daniel Kehlmann,"Kehlmann, Daniel",Carol Brown Janeway,0375424466,9780375424465,0,3.74,Pantheon,Hardcover,259,2006,2005,,25-01-20,to-read,to-read (#274),to-read,0
6969,Emma,Jane Austen,"Austen, Jane",Fiona Stafford,0141439580,9780141439587,0,4.03,Penguin Books,Paperback,474,2003,1815,,25-01-20,to-read,to-read (#272),to-read,0
14935,Sense and Sensibility,Jane Austen,"Austen, Jane","Tony Tanner, Juliet Stevenson, Sam Ngo, Sara Singh, Rosalind Ballaster, Ros Ballaster",,,0,4.08,Penguin Books,Paperback,409,2003,1811,,25-01-20,to-read,to-read (#271),to-read,0
62555,On Human Nature,Edward O. Wilson,"Wilson, Edward O.",,0674016386,9780674016385,0,4.16,Harvard University Press ,Paperback,288,2004,1978,,25-01-20,to-read,to-read (#270),to-read,0
183818,The Insect Societies,Edward O. Wilson,"Wilson, Edward O.",,0674454952,9780674454958,0,4.69,Belknap Press,Paperback,548,1971,1971,,25-01-20,to-read,to-read (#269),to-read,0
20665570,The Meaning of Human Existence,Edward O. Wilson,"Wilson, Edward O.",,0871401002,9780871401007,0,3.86,Liveright Publishing,Hardcover,207,2014,2014,,25-01-20,to-read,to-read (#268),to-read,0
55981,Consilience: The Unity of Knowledge,Edward O. Wilson,"Wilson, Edward O.",,067976867X,9780679768678,0,3.99,Vintage,Paperback,368,1999,1998,,25-01-20,to-read,to-read (#267),to-read,0
