Book Id,Title,Author,Author l-f,Additional Authors,ISBN,ISBN13,My Rating,Average Rating,Publisher,Binding,Number of Pages,Year Published,Original Publication Year,Date Read,Date Added,Bookshelves,Bookshelves with positions,Exclusive Shelf,Read Count
261764,It Was Five Past Midnight In Bhopal,Dominique Lapierre,"Lapierre, Dominique",Javier Moro,8176210919,9788176210911,0,4.18,"Delhi: Full Circle Pub,",,376,2001,2001,,05-03-21,to-read,to-read (#471),to-read,0
27175470,Brida,Paulo Coelho,"Coelho, Paulo",,1514149915,9781514149911,3,3.49,Createspace,Paperback,80,2015,1990,,22-01-20,,,read,1
53214552,"Better Data Visualizations: A Guide for Scholars, Researchers, and Wonks",Jonathan Schwabish,"Schwabish, Jonathan",,0231193114,9780231193115,0,4.5,Columbia University Press,Paperback,464,2021,,,01-03-21,to-read,to-read (#470),to-read,0
28370086,How to Have a Good Day: Harness the Power of Behavioral Science to Transform Your Working Life,Caroline  Webb,"Webb, Caroline",,,,0,4.02,Crown Business,Kindle Edition,370,2016,2016,,28-02-21,to-read,to-read (#469),to-read,0
55941567,We Keep the Dead Close: A Murder at Harvard and a Half Century of Silence,Becky Cooper,"Cooper, Becky",,,,5,3.76, Cornerstone Digital,Kindle Edition,422,2020,2020,27-02-21,01-11-20,,,read,1
27157963,"Guatemala, las líneas de su mano (Biblioteca Americana)",Luis Cardoza y Aragón,"Aragón, Luis Cardoza y","Eugenia Huerta, Arturo Taracena Arriola",,,0,4.56,Fondo de Cultura Económica,Kindle Edition,455,2005,1955,,21-02-21,to-read,to-read (#468),to-read,0
56374972,Think Again: The Power of Knowing What You Don't Know,Adam M. Grant,"Grant, Adam M.",,,,0,4.25,Viking,Hardcover,320,2021,2021,,16-02-21,to-read,to-read (#467),to-read,0
18579748,Connection: Hollywood Storytelling Meets Critical Thinking,Randy Olson,"Olson, Randy","Dorie Barton, Brian Palermo",0615872387,9780615872384,5,4.07,Prairie Starfish Productions,Paperback,284,2013,2013,29-01-21,05-01-20,,,read,1
33606119,Why I'm No Longer Talking to White People About Race,Reni Eddo-Lodge,"Eddo-Lodge, Reni",,140887055X,9781408870556,5,4.38,Bloomsbury Circus,Hardcover,249,2017,2017,05-08-20,15-01-20,,,read,1
8690080,Escape from the Ivory Tower: A Guide to Making Your Science Matter,Nancy Baron,"Baron, Nancy",Liz Neeley,1597266647,9781597266642,5,3.81,Island Press,Paperback,272,2010,2010,18-10-20,06-09-20,,,read,1
763331,Flu: The Story Of the Great Influenza Pandemic of 1918 and the Search for the Virus That Caused It,Gina Kolata,"Kolata, Gina",,0743203984,9780743203982,5,3.91,Atria Books,Paperback,352,2019,1999,23-05-20,07-04-20,,,read,1
52745048,Mission Economy: A Moonshot Guide to Changing Capitalism,Mariana Mazzucato,"Mazzucato, Mariana",,0241435315,9780241435311,0,4.01,Allen Lane,Paperback,272,2021,2020,,10-02-21,to-read,to-read (#466),to-read,0
17987621,The Entrepreneurial State: Debunking Public vs. Private Sector Myths,Mariana Mazzucato,"Mazzucato, Mariana",Carlota Pérez,0857282514,9780857282514,0,3.96,Anthem Press,ebook,266,2013,2011,,10-02-21,to-read,to-read (#465),to-read,0
29502362,The Value of Everything: Making and Taking in the Global Economy,Mariana Mazzucato,"Mazzucato, Mariana",,161039674X,9781610396745,0,4.1,PublicAffairs,Hardcover,384,2018,2018,,10-02-21,to-read,to-read (#464),to-read,0
52770736,The Zoologist's Guide to the Galaxy: What Animals on Earth Reveal about Aliens – and Ourselves,Arik Kershenbaum,"Kershenbaum, Arik",,024140679X,9780241406793,0,4.02,Viking,Hardcover,356,2020,2020,,26-01-21,to-read,to-read (#463),to-read,0
50489318,"A People Betrayed: A History of Corruption, Political Incompetence and Social Division in Modern Spain",Paul Preston,"Preston, Paul",,0871408686,9780871408686,0,4.04,Liveright,Hardcover,768,2020,2020,,26-01-21,to-read,to-read (#462),to-read,0
40630,How Europe Underdeveloped Africa,Walter Rodney,"Rodney, Walter",Vincent Harding,0882580965,9780882580968,0,4.38,Howard University Press,Paperback,312,1981,1971,,26-01-21,to-read,to-read (#461),to-read,0
44901216,Necropolitics,Achille Mbembe,"Mbembe, Achille",Steve Corcoran,1478005858,9781478005858,0,4.21,Duke University Press Books,Hardcover,224,2019,,,26-01-21,to-read,to-read (#460),to-read,0
29504097,Afrotopia,Felwine Sarr,"Sarr, Felwine",,284876502X,9782848765020,0,4.13,French and European Publications Inc,Paperback,154,2016,,,26-01-21,to-read,to-read (#459),to-read,0
51750,Writing Tools: 50 Essential Strategies for Every Writer,Roy Peter Clark,"Clark, Roy Peter",,0316014982,9780316014984,0,4.18,"Little, Brown and Company",Hardcover,260,2006,2006,,25-01-21,to-read,to-read (#458),to-read,0
56494842,Manners Will Take You Where Brains and Money Won't: Wisdom from Momma and 35 Years at NASA,Donald G. James,"James, Donald G.","Congressman Eric Swalwell, Captain Dennis D James",1735674001,9781735674001,0,4.25,,Paperback,,2021,,,24-01-21,to-read,to-read (#457),to-read,0
18079745,"Me, Myself, and Why: Searching for the Science of Self",Jennifer Ouellette,"Ouellette, Jennifer",,0143121650,9780143121657,0,3.56,Penguin,Paperback,336,2014,2014,,19-01-21,to-read,to-read (#456),to-read,0
74812,Born on a Blue Day: Inside the Extraordinary Mind of an Autistic Savant,Daniel Tammet,"Tammet, Daniel",,1416535071,9781416535072,0,3.8,Free Press,Hardcover,226,2007,2006,,11-01-21,to-read,to-read (#455),to-read,0
48999289,Carta de un ateo guatemalteco al Santo Padre,Rodrigo Rey Rosa,"Rosa, Rodrigo Rey",,8420451444,9788420451442,0,3.29,Alfaguara,Paperback,240,2020,,,10-01-21,to-read,to-read (#454),to-read,0
50979078,"MIGRANTE: Soy maya q’anjoba’l, guatemalteco, migrante, hijo, hermano, esposo, padre y emprendedor tecnológico: mis raíces son mi fortaleza y nuestra historia, mi testimonio.",Marcos Antil,"Antil, Marcos","Gustavo Montenegro, Rigoberta Menchú, Yana Antil",,,0,4.56,,Kindle Edition,350,2019,,,10-01-21,to-read,to-read (#453),to-read,0
2184798,Blood River: A Journey to Africa's Broken Heart,Tim Butcher,"Butcher, Tim",,0099494280,9780099494287,0,3.86,Vintage,Paperback,363,2008,2007,,10-01-21,to-read,to-read (#452),to-read,0
32145,Stiff: The Curious Lives of Human Cadavers,Mary Roach,"Roach, Mary",,0393324826,9780393324822,0,4.04,W. W. Norton  Company,Paperback,303,2004,2003,,10-01-21,to-read,to-read (#451),to-read,0
3109,The Omnivore's Dilemma: A Natural History of Four Meals,Michael Pollan,"Pollan, Michael",,1594200823,9781594200823,0,4.16,The Penguin Press,Hardcover,450,2006,2006,,10-01-21,to-read,to-read (#450),to-read,0
12743473,The Storytelling Animal: How Stories Make Us Human,Jonathan Gottschall,"Gottschall, Jonathan",,0547391404,9780547391403,0,3.72,Houghton Mifflin Harcourt,Hardcover,248,2012,2012,,10-01-21,to-read,to-read (#449),to-read,0
588138,The Hero With a Thousand Faces,Joseph Campbell,"Campbell, Joseph",,0691017840,9780691017846,0,4.12,Princeton University Press,Paperback,416,1972,1949,,10-01-21,to-read,to-read (#448),to-read,0
38923582,How Humans Learn: The Science and Stories behind Effective College Teaching,Joshua R. Eyler,"Eyler, Joshua R.",,1946684643,9781946684646,0,4.05,West Virginia University Press,Paperback,312,2018,2018,,10-01-21,to-read,to-read (#447),to-read,0
35099718,So You Want to Talk About Race,Ijeoma Oluo,"Oluo, Ijeoma",,1580056776,9781580056779,0,4.49,Seal Press,Hardcover,248,2018,2018,,10-01-21,to-read,to-read (#446),to-read,0
194065,Clueless in Academe: How Schooling Obscures the Life of the Mind,Gerald Graff,"Graff, Gerald",,0300105142,9780300105148,0,3.85,Yale University Press,Paperback,320,2004,2003,,10-01-21,to-read,to-read (#444),to-read,0
28514478,Who Rules the World?,Noam Chomsky,"Chomsky, Noam",,162779381X,9781627793810,0,4.05,Metropolitan Books/Henry Holt & Co. (NYC),Hardcover,320,2016,2014,,09-01-21,to-read,to-read (#443),to-read,0
32075671,"The Hate U Give (The Hate U Give, #1)",Angie Thomas,"Thomas, Angie",,,,0,4.49,Balzer + Bray,Hardcover,454,2017,2017,,06-01-21,to-read,to-read (#442),to-read,0
2807996,"The Ghost Map: A Street, an Epidemic and the Hidden Power of Urban Networks",Steven Johnson,"Johnson, Steven",,0141029366,9780141029368,0,3.86,Penguin,Paperback,320,2008,2006,,06-01-21,to-read,to-read (#441),to-read,0
54611540,Tales of Horror & Happiness in Hospitality: How to manage properties internationally & tips on making a profit,Kiona Gangat,"Gangat, Kiona",Maria Gangat,,,0,4.51,,Kindle Edition,,2020,,,03-01-21,to-read,to-read (#440),to-read,0
42853221,Our Women on the Ground: Essays by Arab Women Reporting from the Arab World,Zahra Hankir,"Hankir, Zahra",Christiane Amanpour,,,0,4.49,Penguin Books,Kindle Edition,288,2019,2019,,03-01-21,to-read,to-read (#439),to-read,0
31842332,Brevísima relación de la destruición de las Indias,Bartolomé de las Casas,"Casas, Bartolomé de las",,,,5,3.76,Q,Kindle Edition,116,2015,1552,27-12-20,26-12-20,,,read,1
36475,Wonderful Life: The Burgess Shale and the Nature of History,Stephen Jay Gould,"Gould, Stephen Jay",,039330700X,9780393307009,5,4.14,W. W. Norton & Company,Paperback,352,1990,1989,06-09-20,08-08-20,,,read,1
40796205,"Slime: How Algae Created Us, Plague Us, and Just Might Save Us",Ruth Kassinger,"Kassinger, Ruth",,0544432932,9780544432932,5,3.94,Mariner Books,Hardcover,320,2019,2019,29-06-20,15-01-20,,,read,1
26723887,Life of a Chalkstream,Simon Cooper,"Cooper, Simon",,0007547889,9780007547883,3,3.98,William Collins,Paperback,320,2015,2014,07-04-20,01-03-20,,,read,1
709340,"Colonial Botany: Science, Commerce, and Politics in the Early Modern World",Londa Schiebinger,"Schiebinger, Londa",,0812238273,9780812238273,0,4.21,University of Pennsylvania Press,Hardcover,346,2004,2004,,28-12-20,to-read,to-read (#438),to-read,0
5033575,"Cultures in Conflict: Encounters Between European and Non-European Cultures, 1492-1800",Urs Bitterli,"Bitterli, Urs",,0804721769,9780804721769,0,3.6,Stanford University Press,Paperback,216,1993,1989,,28-12-20,to-read,to-read (#437),to-read,0
19145000,The Elements of Academic Style: Writing for the Humanities,Eric Hayot,"Hayot, Eric",,0231168004,9780231168007,0,4.03,Columbia University Press,Hardcover,256,2014,2014,,19-12-20,to-read,to-read (#436),to-read,0
26835313,Esta desnuda playa,Ana María Rodas,"Rodas, Ana María",,,9789929559660,4,4.6,Editorial cultura,Paperback,103,2015,2015,,16-12-20,,,read,1
53231994,"All We Can Save: Truth, Courage, and Solutions for the Climate Crisis",Ayana Elizabeth Johnson,"Johnson, Ayana Elizabeth","Katharine Keeble Wilkinson, Sherri Mitchell, Catherine Pierce, Kate Marvel, Adrienne Maree Brown, Jacqueline Patterson, Janine Benyus, Camille T Dungy, Mary Anne Hitt, Abigail Dillen, Leah C Stokes, Joy Harjo, Maggie Thomas, Marge Piercy, Varshini Prakash",0593237064,9780593237069,0,4.57,One World,Hardcover,448,2020,2020,,15-12-20,to-read,to-read (#435),to-read,0
19501,"Eat, Pray, Love: One Woman's Search for Everything Across Italy, India and Indonesia",Elizabeth Gilbert,"Gilbert, Elizabeth",,0143038419,9780143038412,4,3.59,Riverhead Books,Paperback,368,2007,2006,10-12-20,18-10-20,,,read,1
19148706,The Ethiopian Wolf: Hope at the Edge of Extinction,Will Burran-Lucas,"Burran-Lucas, Will","Rebecca R. Jackrel, Jaymi Heimbuch",0981581315,9780981581316,0,5,Lobelia Press,Hardcover,152,2013,2013,,06-12-20,to-read,to-read (#434),to-read,0
53113335,My Wild Life: Adventures of a Wildlife Photographer,Suzi Eszterhas,"Eszterhas, Suzi",,1771474076,9781771474078,0,4.24,Owl Kids ,Hardcover,32,2020,2020,,06-12-20,to-read,to-read (#433),to-read,0
51343040,Unsustainable Inequalities: Social Justice and the Environment,Lucas Chancel,"Chancel, Lucas",Malcolm DeBevoise,067498465X,9780674984653,0,3.96,Belknap Press,Hardcover,184,2020,2017,,01-12-20,to-read,to-read (#432),to-read,0
51777430,The Alchemy of Us: How Humans and Matter Transformed One Another,Ainissa Ramirez,"Ramirez, Ainissa",,0262043807,9780262043809,0,3.98,MIT Press,Hardcover,328,2020,2020,,01-12-20,to-read,to-read (#431),to-read,0
52767659,The End of Everything (Astrophysically Speaking),Katie  Mack,"Mack, Katie",,198210354X,9781982103545,0,4.27,Scribner,Hardcover,240,2020,2020,,01-12-20,to-read,to-read (#430),to-read,0
50887097,"Why Fish Don't Exist: A Story of Loss, Love, and the Hidden Order of Life",Lulu Miller,"Miller, Lulu",,,,0,4.21,Simon  Schuster,Hardcover,225,2020,2020,,01-12-20,to-read,to-read (#429),to-read,0
332613,One Flew Over the Cuckoo's Nest,Ken Kesey,"Kesey, Ken",,,,0,4.19,Signet,Mass Market Paperback,325,1963,1962,,01-12-20,to-read,to-read (#428),to-read,0
10155,The Lost World (Professor Challenger #1),Arthur Conan Doyle,"Doyle, Arthur Conan",,0812967259,9780812967258,0,3.93,Modern Library,Paperback,272,2003,1912,,01-12-20,to-read,to-read (#427),to-read,0
35510008,This is Going to Hurt: Secret Diaries of a Junior Doctor,Adam Kay,"Kay, Adam",,,,0,4.39,Picador,Kindle Edition,285,2017,2017,,25-01-20,to-read,to-read (#264),to-read,0
8063514,"The Pain Chronicles: Cures, Myths, Mysteries, Prayers, Diaries, Brain Scans, Healing, and the Science of Suffering",Melanie Thernstrom,"Thernstrom, Melanie",,0865476810,9780865476813,0,3.82,Farrar Straus Giroux,Hardcover,364,2010,2010,,22-11-20,to-read,to-read (#426),to-read,0
567264,"Reckoning with the Beast: Animals, Pain, and Humanity in the Victorian Mind",James C. Turner,"Turner, James C.",,0801866774,9780801866777,0,3.85,Johns Hopkins University Press,Paperback,204,2000,1980,,22-11-20,to-read,to-read (#425),to-read,0
35605474,Ask Me About My Uterus: A Quest to Make Doctors Believe in Women's Pain,Abby Norman,"Norman, Abby",,1568585810,9781568585819,0,3.94,Bold Type Books,Hardcover,288,2018,2018,,22-11-20,to-read,to-read (#424),to-read,0
7034922,Democracy Kills: What's So Good about the Vote?,Humphrey Hawksley,"Hawksley, Humphrey",,0230744087,9780230744080,0,3.83,MacMillan,Paperback,397,2009,2009,,20-11-20,to-read,to-read (#423),to-read,0
43611749,Asian Waters: The Struggle Over the South China Sea and the Strategy of Chinese Expansion,Humphrey Hawksley,"Hawksley, Humphrey",,,,0,4.04,Abrams Press,Kindle Edition,304,2018,2018,,20-11-20,to-read,to-read (#421),to-read,0
52609184,"Man on Edge [Rake Ozenna, #2]",Humphrey Hawksley,"Hawksley, Humphrey",,0727889141,9780727889140,0,4.12,Severn House Publishers,Hardcover,288,2020,2007,,20-11-20,to-read,to-read (#422),to-read,0
8520610,Quiet: The Power of Introverts in a World That Can't Stop Talking,Susan Cain,"Cain, Susan",Carlo Prosperi,0307352145,9780307352149,0,4.06,"Crown Publishing Group/Random House, Inc.",Hardcover,352,2012,2012,,18-11-20,to-read,to-read (#420),to-read,0
12514237,Afuera,Javier Payeras,"Payeras, Javier",,9993969885,9789993969884,0,3.92,Magna Terra Editores,Paperback,,2006,2006,,18-11-20,,,read,2
7799004,Merchants of Doubt: How a Handful of Scientists Obscured the Truth on Issues from Tobacco Smoke to Global Warming,Naomi Oreskes,"Oreskes, Naomi",Erik M. Conway,1596916109,9781596916104,0,4.18,Bloomsbury Press,Hardcover,357,2010,2010,,18-11-20,to-read,to-read (#419),to-read,0
87040,Gathering Moss: A Natural and Cultural History of Mosses,Robin Wall Kimmerer,"Kimmerer, Robin Wall",,0870714996,9780870714993,0,4.41,Oregon State University Press,Paperback,168,2003,2003,,17-11-20,to-read,to-read (#418),to-read,0
54596822,La estrella solitaria,Alfonso Domingo,"Domingo, Alfonso",,,9788498777079,0,5,Algaida Editores,Paperback,442,2012,,,16-11-20,to-read,to-read (#417),to-read,0
50756998,Out of Africa,Isak Dinesen,"Dinesen, Isak",Karen Blixen,,,4,3.89,,Kindle Edition,412,2019,1937,,08-01-20,,,read,1
49464,Save the Cat: The Last Book on Screenwriting You'll Ever Need,Blake Snyder,"Snyder, Blake",,1932907009,9781932907001,0,4.05,Michael Wiese Productions,Paperback,195,2005,2005,,12-11-20,to-read,to-read (#416),to-read,0
49680197,The Parasitic Mind: How Infectious Ideas Are Killing Common Sense,Gad Saad,"Saad, Gad",,162157959X,9781621579595,0,3.99,Regnery Publishing,Hardcover,235,2020,2020,,11-11-20,to-read,to-read (#415),to-read,0
61550,The Logic of Scientific Discovery,Karl Popper,"Popper, Karl",,0415278449,9780415278447,0,4.03,Routledge,Paperback,544,2002,1934,,11-11-20,to-read,to-read (#414),to-read,0
26114430,What a Fish Knows: The Inner Lives of Our Underwater Cousins,Jonathan Balcombe,"Balcombe, Jonathan",,0374288216,9780374288211,0,4.2,"Scientific American / Farrar, Straus and Giroux",Hardcover,304,2016,2016,,01-11-20,to-read,to-read (#413),to-read,0
51801261,The World According to Physics,Jim Al-Khalili,"Al-Khalili, Jim",,0691182302,9780691182308,0,4.19,Princeton University Press,Hardcover,304,2020,2020,,24-10-20,to-read,to-read (#412),to-read,0
35187175,Storm in a Teacup: The Physics of Everyday Life,Helen Czerski,"Czerski, Helen",,0393355470,9780393355475,0,4.02,W. W. Norton  Company,Paperback,288,2018,2017,,19-10-20,to-read,to-read (#411),to-read,0
19063,The Book Thief,Markus Zusak,"Zusak, Markus",,,,0,4.38,Alfred A. Knopf,Hardcover,552,2006,2005,,18-10-20,to-read,to-read (#410),to-read,0
7108725,Start with Why: How Great Leaders Inspire Everyone to Take Action,Simon Sinek,"Sinek, Simon",,1591842808,9781591842804,2,4.08,Portfolio,Hardcover,256,2009,2009,18-10-20,15-01-20,,,read,1
11324722,The Righteous Mind: Why Good People Are Divided by Politics and Religion,Jonathan Haidt,"Haidt, Jonathan",,,,0,4.19,Pantheon,Hardcover,419,2012,2012,,17-10-20,to-read,to-read (#409),to-read,0
17465709,"Braiding Sweetgrass: Indigenous Wisdom, Scientific Knowledge, and the Teachings of Plants",Robin Wall Kimmerer,"Kimmerer, Robin Wall",,1571313354,9781571313355,0,4.56,Milkweed Editions,Hardcover,391,2013,2013,,16-10-20,to-read,to-read (#408),to-read,0
44431860,More Myself: A Journey,Alicia Keys,"Keys, Alicia",Michelle Burford,,,0,4.14,Flatiron Books,Kindle Edition,272,2020,2020,,25-09-20,to-read,to-read (#407),to-read,0
7558003,"White Space Is Not Your Enemy: A Beginner's Guide to Communicating Visually Through Graphic, Web and Multimedia Design",Kim Golombisky,"Golombisky, Kim",Rebecca Hagen,0240812816,9780240812816,0,3.83,A K PETERS,Paperback,273,2010,2010,,17-09-20,to-read,to-read (#406),to-read,0
8166813,Essentials of the Living World,George B. Johnson,"Johnson, George B.",Jonathan B. Losos,0077280075,9780077280079,0,3.25,McGraw-Hill Higher Education,Paperback,686,2009,2005,,16-09-20,to-read,to-read (#405),to-read,0
6752128,Lizards in an Evolutionary Tree: Ecology and Adaptive Radiation of Anoles,Jonathan B. Losos,"Losos, Jonathan B.",,0520255917,9780520255913,0,4.5,University of California Press,Hardcover,528,2009,2009,,16-09-20,to-read,to-read (#404),to-read,0
6842046,The Theory of Island Biogeography Revisited,Jonathan B. Losos,"Losos, Jonathan B.",Robert E. Ricklefs,069113653X,9780691136530,0,4.6,Princeton University Press,Paperback,496,2009,2009,,16-09-20,to-read,to-read (#403),to-read,0
33357463,"Improbable Destinies: Fate, Chance, and the Future of Evolution",Jonathan B. Losos,"Losos, Jonathan B.",,0399184929,9780399184925,0,4.07,Riverhead Books,Hardcover,368,2017,2017,,16-09-20,to-read,to-read (#402),to-read,0
27311908,How Evolution Shapes Our Lives: Essays on Biology and Society,Jonathan B. Losos,"Losos, Jonathan B.",Richard E Lenski,0691170398,9780691170398,0,3.67,Princeton University Press,Paperback,416,2016,,,16-09-20,to-read,to-read (#401),to-read,0
17804362,Walden's Shore: Henry David Thoreau and Nineteenth-Century Science,Robert M. Thorson,"Thorson, Robert M.",,067472478X,9780674724785,0,4.3,Harvard University Press,Hardcover,421,2014,2014,,16-09-20,to-read,to-read (#400),to-read,0
6411303,Beyond Walden: The Hidden History of America's Kettle Lakes and Ponds,Robert M. Thorson,"Thorson, Robert M.",,0802716458,9780802716453,0,4.18,Walker Books,Hardcover,320,2009,2009,,16-09-20,to-read,to-read (#399),to-read,0
375691,Stone by Stone: The Magnificent History in New England's Stone Walls,Robert M. Thorson,"Thorson, Robert M.",,0802776876,9780802776877,0,4.01,Walker Books,Paperback,304,2004,2002,,16-09-20,to-read,to-read (#398),to-read,0
27220736,Shoe Dog: A Memoir by the Creator of Nike,Phil Knight,"Knight, Phil",,1501135910,9781501135910,0,4.46,Scribner,Hardcover,400,2016,2016,,15-09-20,to-read,to-read (#397),to-read,0
12391521,The Psychopath Test: A Journey Through the Madness Industry,Jon Ronson,"Ronson, Jon",,1594485755,9781594485756,0,3.94,Riverhead Books,Paperback,275,2012,2011,,07-09-20,to-read,to-read (#396),to-read,0
22738563,We Should All Be Feminists,Chimamanda Ngozi Adichie,"Adichie, Chimamanda Ngozi",,,,0,4.42,Vintage,Kindle Edition,64,2014,2012,,07-09-20,to-read,to-read (#395),to-read,0
503051,The Diversity of Life,Edward O. Wilson,"Wilson, Edward O.",,0393319407,9780393319408,0,4.2,W. W. Norton  Company,Paperback,432,1999,1992,,07-09-20,to-read,to-read (#394),to-read,0
8167094,The Hidden Reality: Parallel Universes and the Deep Laws of the Cosmos,Brian Greene,"Greene, Brian",,0307265633,9780307265630,0,4.09,Knopf,Hardcover,384,2011,2011,,07-09-20,to-read,to-read (#393),to-read,0
373969,The Stuff of Thought: Language as a Window into Human Nature,Steven Pinker,"Pinker, Steven",,0670063274,9780670063277,0,3.91,Viking Penguin,Hardcover,499,2007,2007,,07-09-20,to-read,to-read (#392),to-read,0
25019,"The Professor and the Madman: A Tale of Murder, Insanity and the Making of the Oxford English Dictionary",Simon Winchester,"Winchester, Simon",,0060839783,9780060839789,0,3.82,Harper Perennial,Paperback,242,2005,1998,,07-09-20,to-read,to-read (#391),to-read,0
4591,Genome: the Autobiography of a Species in 23 Chapters,Matt Ridley,"Ridley, Matt",,0060894083,9780060894085,0,4.05,Harper Perennial,Paperback,344,2006,1999,,07-09-20,to-read,to-read (#390),to-read,0
17977,The Ancestor's Tale: A Pilgrimage to the Dawn of Evolution,Richard Dawkins,"Dawkins, Richard",,061861916X,9780618619160,0,4.13,Mariner Books,Paperback,688,2005,2004,,07-09-20,to-read,to-read (#389),to-read,0
156599,Last Child in the Woods: Saving Our Children from Nature-Deficit Disorder,Richard Louv,"Louv, Richard",,1565125223,9781565125223,0,3.95,Algonquin Books,Paperback,310,2006,2005,,04-09-20,to-read,to-read (#388),to-read,0
23164961,The Fly Trap,Fredrik Sjöberg,"Sjöberg, Fredrik",Thomas Teal,110187015X,9781101870150,0,3.68,Pantheon,Hardcover,288,2015,2004,,03-09-20,to-read,to-read (#387),to-read,0
28696605,Being a Beast: Adventures Across the Species Divide,Charles Foster,"Foster, Charles",,1627796339,9781627796330,0,3.21,Metropolitan Books,Hardcover,256,2016,2016,,03-09-20,to-read,to-read (#386),to-read,0
26031368,GoatMan: How I Took a Holiday from Being Human (one man's journey to leave humanity behind and become like a goat),Thomas Thwaites,"Thwaites, Thomas",,1616894059,9781616894054,0,3.77,Princeton Architectural Press,Hardcover,208,2016,2016,,03-09-20,to-read,to-read (#385),to-read,0
18684783,"This is Improbable Too - Synchronized Cows, Speedy Brain Extractors and More WTF Research",Marc Abrahams,"Abrahams, Marc",,1780743610,9781780743615,0,3.09,Oneworld Publications,Paperback,288,2014,2014,,03-09-20,to-read,to-read (#384),to-read,0
14506498,"This Is Improbable: Cheese String Theory, Magnetic Chickens, and Other WTF Research",Marc Abrahams,"Abrahams, Marc",,1851689311,9781851689316,0,3.06,Oneworld Publications,Paperback,299,2012,2012,,03-09-20,to-read,to-read (#383),to-read,0
9593,Galápagos,Kurt Vonnegut Jr.,"Jr., Kurt Vonnegut",,0385333870,9780385333870,0,3.85,Dial Press,Paperback,324,1999,1985,,27-08-20,to-read,to-read (#382),to-read,0
420967,A Fatal Inversion,Barbara Vine,"Vine, Barbara",Ruth Rendell,0140158618,9780140158618,0,3.94,Penguin Canada,Paperback,320,1992,1987,,27-08-20,to-read,to-read (#381),to-read,0
49127470,Mill Town: Reckoning with What Remains,Kerri Arsenault,"Arsenault, Kerri",,1250155932,9781250155931,0,3.73,St. Martin's Press,Hardcover,368,2020,2020,,25-08-20,to-read,to-read (#380),to-read,0
20454074,The Marshmallow Test: Mastering Self-Control,Walter Mischel,"Mischel, Walter",,0316230871,9780316230872,0,3.69,"Little, Brown Spark",Hardcover,336,2014,2014,,17-08-20,to-read,to-read (#379),to-read,0
13529055,Mortality,Christopher Hitchens,"Hitchens, Christopher",,1455502758,9781455502752,0,4.06,Twelve,Hardcover,104,2012,2012,,13-08-20,to-read,to-read (#378),to-read,0
28256439,The Hidden Life of Trees,Peter Wohlleben,"Wohlleben, Peter","Tim Flannery, Jane Billinghurst, Suzanne Simard",1771642483,9781771642484,0,4.04,Greystone Books,Hardcover,288,2016,2015,,13-08-20,to-read,to-read (#377),to-read,0
14894629,The Half Has Never Been Told: Slavery and the Making of American Capitalism,Edward E. Baptist,"Baptist, Edward E.",,046500296X,9780465002962,0,4.45,Basic Books,Hardcover,498,2014,2013,,13-08-20,to-read,to-read (#376),to-read,0
254705,Winter World: The Ingenuity of Animal Survival,Bernd Heinrich,"Heinrich, Bernd",,0060957379,9780060957377,0,4.07,Harpperen,Paperback,368,2003,2003,,13-08-20,to-read,to-read (#375),to-read,0
8162151,"The Fever: How Malaria Has Ruled Humankind for 500,000 Years",Sonia Shah,"Shah, Sonia",,0374230013,9780374230012,0,3.91,Sarah Crichton Books,Hardcover,307,2010,2010,,13-08-20,to-read,to-read (#374),to-read,0
49436,Three Cups of Tea: One Man's Mission to Promote Peace ... One School at a Time,Greg Mortenson,"Mortenson, Greg",David Oliver Relin,0143038257,9780143038252,0,3.65,Penguin ,Paperback,349,2007,2006,,13-08-20,to-read,to-read (#373),to-read,0
89281,"Why People Believe Weird Things: Pseudoscience, Superstition, and Other Confusions of Our Time",Michael Shermer,"Shermer, Michael",Stephen Jay Gould,0805070893,9780805070897,0,3.87,Holt Paperbacks,Paperback,384,2002,1997,,08-08-20,to-read,to-read (#372),to-read,0
36355617,Your Silence Will Not Protect You: Essays and Poems,Audre Lorde,"Lorde, Audre","Sara Ahmed, Reni Eddo-Lodge",0995716226,9780995716223,0,4.65,Silver Press,Paperback,229,2017,2017,,05-08-20,to-read,to-read (#371),to-read,0
19218294,On Being a Data Skeptic,Cathy O'Neil,"O'Neil, Cathy",,1491947233,9781491947234,0,3.81,O'Reilly Media,ebook,28,2013,2013,,04-08-20,to-read,to-read (#370),to-read,0
