Book Id,Title,Author,Author l-f,Additional Authors,ISBN,ISBN13,My Rating,Average Rating,Publisher,Binding,Number of Pages,Year Published,Original Publication Year,Date Read,Date Added,Bookshelves,Bookshelves with positions,Exclusive Shelf,Read Count
18283581,A biography of Antoni van Leeuwenhoek,Alma Smith Payne,"Payne, Alma Smith",,,,0,3.33,Macmillan,Hardcover,125,1970,1966,,15-01-20,to-read,to-read (#152),to-read,0
12851169,"The Epigenetics Revolution: How Modern Biology Is Rewriting Our Understanding of Genetics, Disease and Inheritance",Nessa Carey,"Carey, Nessa",,1848313470,9781848313477,3,4.07,Icon Books Company,Paperback,339,2012,2011,,05-01-20,,,read,1
61661,The Varieties of Scientific Experience: A Personal View of the Search for God,Carl Sagan,"Sagan, Carl",Ann Druyan,1594201072,9781594201073,0,4.28,Penguin Press,Hardcover,284,2006,2006,,12-01-20,to-read,to-read (#150),to-read,0
13006,Julius Caesar,William Shakespeare,"Shakespeare, William",Roma Gill,0198320272,9780198320272,5,3.69,"Oxford University Press, USA",Paperback,128,2002,1599,,12-01-20,,,read,1
77903,Bodas de sangre,Federico García Lorca,"Lorca, Federico García","Allen Josephs, Juan Caballero",8437605601,9788437605609,4,3.87,Cátedra,Paperback,176,2005,1932,,12-01-20,,,read,1
1134734,Rimas,Gustavo Adolfo Bécquer,"Bécquer, Gustavo Adolfo",,8475058647,9788475058641,4,4.21,Grupo Oceano,Paperback,0,2002,1868,,12-01-20,,,read,1
206172,The Pit and the Pendulum - an Edgar Allan Poe Short Story,Edgar Allan Poe,"Poe, Edgar Allan",,0146000110,9780146000119,5,4.2,Penguin Books,Paperback,56,1995,1842,,12-01-20,,,read,1
175516,The Fall of the House of Usher - an Edgar Allan Poe Short Story,Edgar Allan Poe,"Poe, Edgar Allan",,1594561796,9781594561795,5,3.93,BookSurge Classics,Paperback,36,2004,1839,,12-01-20,,,read,1
3873,"A History of God: The 4,000-Year Quest of Judaism, Christianity, and Islam",Karen Armstrong,"Armstrong, Karen",,0517223120,9780517223123,0,3.87,Gramercy Books,Hardcover,460,2004,1993,,12-01-20,to-read,to-read (#149),to-read,0
49060,Emotion: The Science of Sentiment,Dylan Evans,"Evans, Dylan",,0192853767,9780192853769,0,3.61,"Oxford University Press, USA",Paperback,204,2002,2001,,12-01-20,to-read,to-read (#148),to-read,0
9491855,"Why the West Rules—for Now: The Patterns of History, and What They Reveal About the Future",Ian Morris,"Morris, Ian",,1429977043,9781429977043,0,4.11,"Farrar, Straus and Giroux",ebook,768,2010,2010,,12-01-20,to-read,to-read (#147),to-read,0
194527,A History of Western Music,J. Peter Burkholder,"Burkholder, J. Peter","Donald Jay Grout, Claude V. Palisca",0393979911,9780393979916,0,3.97,W. W. Norton & Company,Hardcover,1136,2005,1960,,12-01-20,to-read,to-read (#146),to-read,0
14318,Chronicles: Volume One,Bob Dylan,"Dylan, Bob",,0743244583,9780743244589,0,3.94,Simon  Schuster,Paperback,320,2005,2004,,12-01-20,to-read,to-read (#145),to-read,0
50039,I'm with the Band: Confessions of a Groupie,Pamela Des Barres,"Barres, Pamela Des",Dave Navarro,1556525893,9781556525896,0,3.67,Chicago Review Press,Paperback,320,2005,1987,,06-01-20,to-read,to-read (#53),to-read,0
14595,Please Kill Me: The Uncensored Oral History of Punk,Legs McNeil,"McNeil, Legs",Gillian McCain,0802142648,9780802142641,0,4.17,Grove Press,Paperback,452,2006,1996,,12-01-20,to-read,to-read (#144),to-read,0
341879,Just Kids,Patti Smith,"Smith, Patti",,006621131X,9780066211312,0,4.15,Ecco,Hardcover,304,2010,2010,,06-01-20,to-read,to-read (#51),to-read,0
676555,The Beatles Anthology,The Beatles,"Beatles, The","John Lennon, Paul McCartney, Ringo Starr, George Harrison",0811826848,9780811826846,0,4.37,Chronicle Books,Hardcover,368,2000,2000,,06-01-20,to-read,to-read (#50),to-read,0
6723170,"I Don't Care About Your Band: Lessons Learned from Indie Rockers, Trust Funders, Pornographers, Felons, Faux-Sensitive Hipsters, and Other Guys I've Dated",Julie Klausner,"Klausner, Julie",,159240524X,9781592405244,0,3.45,Gotham,Paperback,256,2010,2010,,12-01-20,to-read,to-read (#143),to-read,0
36087,Mind Wide Open: Your Brain and the Neuroscience of Everyday Life,Steven Johnson,"Johnson, Steven",,0743241665,9780743241663,0,3.9,Scribner,Paperback,274,2005,1999,,12-01-20,to-read,to-read (#142),to-read,0
35521,"I, Me, Mine",George Harrison,"Harrison, George",,0811859002,9780811859004,0,4.03,Chronicle Books,Paperback,456,2007,1980,,12-01-20,to-read,to-read (#141),to-read,0
20828370,The Wild Truth: A Memoir,Carine McCandless,"McCandless, Carine",Jon Krakauer,0062325140,9780062325143,0,3.78,HarperOne,Hardcover,278,2014,2014,,12-01-20,to-read,to-read (#140),to-read,0
5148,A Separate Peace,John Knowles,"Knowles, John",David Levithan,,,3,3.59,Scribner,Paperback,208,2003,1959,,12-01-20,,,read,1
33297,The Naked Ape,Desmond Morris,"Morris, Desmond",,0385334303,9780385334303,0,3.95,Delta,Paperback,256,1999,1967,,12-01-20,to-read,to-read (#139),to-read,0
27333,Silent Spring,Rachel Carson,"Carson, Rachel","Linda Lear, Edward O. Wilson",0618249060,9780618249060,0,3.99,Mariner Books,Paperback,378,2002,1962,,12-01-20,to-read,to-read (#138),to-read,0
326851,Rosalind Franklin: The Dark Lady of DNA,Brenda Maddox,"Maddox, Brenda",,0060985089,9780060985080,0,4.12,Harper Perennial,Paperback,416,2003,2002,,06-01-20,to-read,to-read (#43),to-read,0
49234,The Third Chimpanzee: The Evolution and Future of the Human Animal,Jared Diamond,"Diamond, Jared",,0060845503,9780060845506,0,4.07,Harper Perennial,Paperback,407,2006,1991,,12-01-20,to-read,to-read (#137),to-read,0
373562,Trilobite: Eyewitness to Evolution,Richard Fortey,"Fortey, Richard",,0375706216,9780375706219,0,4.12,Vintage,Paperback,284,2001,2000,,12-01-20,to-read,to-read (#136),to-read,0
131304,Big Bang: The Origin of the Universe,Simon Singh,"Singh, Simon",,0007162219,9780007162215,0,4.19,Harper Perennial,Paperback,560,2005,2004,,12-01-20,to-read,to-read (#135),to-read,0
979694,Microcosmos: Four Billion Years of Microbial Evolution,Lynn Margulis,"Margulis, Lynn",Dorion Sagan,0520210646,9780520210646,0,4.2,University of California Press,Paperback,304,1997,1986,,12-01-20,to-read,to-read (#134),to-read,0
978098,Auschwitz,Laurence Rees,"Rees, Laurence",,158648303X,9781586483036,0,4.29,PublicAffairs,Hardcover,327,2005,2005,,12-01-20,to-read,to-read (#133),to-read,0
55030,Cosmos,Carl Sagan,"Sagan, Carl",,0375508325,9780375508325,0,4.37,Random House,Mass Market Paperback,365,2002,1980,,12-01-20,to-read,to-read (#132),to-read,0
13547180,Brain on Fire: My Month of Madness,Susannah Cahalan,"Cahalan, Susannah",,145162137X,9781451621372,0,4.05,Free Press,Hardcover,250,2012,2012,,12-01-20,to-read,to-read (#131),to-read,0
29408532,Cantar de Mio Cid,Anonymous,"Anonymous, Anonymous","Ramón Menéndez Pidal, Camilo José Cela",8422625628,9788422625629,3,3.47,Círculo de Lectores,,,1988,1110,,12-01-20,,,read,1
1677,Sobre héroes y tumbas,Ernesto Sabato,"Sabato, Ernesto",,9500716054,9789500716055,0,4.27,Sudamericana,Paperback,547,1999,1961,,12-01-20,to-read,to-read (#130),to-read,0
32289,A Primate's Memoir: A Neuroscientist's Unconventional Life Among the Baboons,Robert M. Sapolsky,"Sapolsky, Robert M.",,0743202414,9780743202411,0,4.36,Scribner,Paperback,304,2002,2001,,10-01-20,to-read,to-read (#129),to-read,0
6295,Howl and Other Poems,Allen Ginsberg,"Ginsberg, Allen",William Carlos Williams,0872863107,9780872863101,0,4.12,City Lights,Hardcover,56,2001,1956,,10-01-20,to-read,to-read (#128),to-read,0
1381,The Odyssey,Homer,"Homer, Homer","Robert Fagles, Bernard Knox",0143039954,9780143039952,5,3.79,Penguin Classics ,Paperback,541,2006,-800,,10-01-20,,,read,1
84981,Tuck Everlasting,Natalie Babbitt,"Babbitt, Natalie",,0374480095,9780374480097,5,3.88,Farrar Straus Giroux,Paperback,148,1985,1975,,10-01-20,,,read,1
50,"Hatchet (Brian's Saga, #1)",Gary Paulsen,"Paulsen, Gary",,0689840926,9780689840920,4,3.75,Atheneum Books for Young Readers: Richard Jackson Books,Hardcover,208,2000,1987,01-01-04,10-01-20,,,read,1
3,"Harry Potter and the Sorcerer's Stone (Harry Potter, #1)",J.K. Rowling,"Rowling, J.K.",,,,3,4.47,Scholastic Inc,Hardcover,309,2003,1997,01-01-02,08-01-20,,,read,1
43232971,The Vagina Bible: The Vulva and the Vagina—Separating the Myth from the Medicine,Jennifer Gunter,"Gunter, Jennifer",,0806539313,9780806539317,5,4.38,Citadel Press,Paperback,420,2019,2019,01-09-19,08-01-20,,,read,1
56167,Feynman's Lost Lecture: The Motion of Planets Around the Sun,David Goodstein,"Goodstein, David","Judith R. Goodstein, Richard P. Feynman",0393039188,9780393039184,0,4.37,W. W. Norton  Company,Hardcover,192,1996,1996,,10-01-20,to-read,to-read (#127),to-read,0
31423607,Girl Logic: The Genius and the Absurdity,Iliza Shlesinger,"Shlesinger, Iliza",,1602863237,9781602863231,0,3.86,Hachette Books,Hardcover,264,2017,2017,,10-01-20,to-read,to-read (#126),to-read,0
40384885,Que la ciencia te acompañe.  A luchar por tus derechos,Agostina Mileo,"Mileo, Agostina",,,9789873752841,0,4.1,DEBATE,Paperback,192,2018,,,09-01-20,to-read,to-read (#125),to-read,0
4887,The Drama of the Gifted Child: The Search for the True Self,Alice   Miller,"Miller, Alice",Ruth Ward,0465016901,9780465016907,0,4.05,Basic Books,Paperback,144,2008,1979,,08-01-20,to-read,to-read (#124),to-read,0
10260,The Pleasure of Finding Things Out: The Best Short Works of Richard P. Feynman,Richard P. Feynman,"Feynman, Richard P.","Jeffrey Robbins, Freeman Dyson",,,0,4.24,Basic Books,Paperback,270,2005,1999,,08-01-20,to-read,to-read (#123),to-read,0
424190,The Nothing That Is: A Natural History of Zero,Robert M.  Kaplan,"Kaplan, Robert M.",Ellen Kaplan,0195142373,9780195142372,0,3.75,"Oxford University Press, USA",Paperback,240,2000,1999,,08-01-20,to-read,to-read (#122),to-read,0
40277241,Brief Answers to the Big Questions,Stephen Hawking,"Hawking, Stephen",,1984819194,9781984819192,0,4.3,Bantam,Hardcover,256,2018,2018,,08-01-20,to-read,to-read (#121),to-read,0
2094,A Briefer History of Time,Stephen Hawking,"Hawking, Stephen",Leonard Mlodinow,0553804367,9780553804362,0,4.24,Bantam,Hardcover,176,2005,1988,,08-01-20,to-read,to-read (#120),to-read,0
10569,On Writing: A Memoir of the Craft,Stephen King,"King, Stephen",,0743455967,9780743455961,0,4.31,Pocket Books,Mass Market Paperback,320,2002,2000,,08-01-20,to-read,to-read (#119),to-read,0
12262741,Wild: From Lost to Found on the Pacific Crest Trail,Cheryl Strayed,"Strayed, Cheryl",,0307592731,9780307592736,0,4.02,Knopf,Hardcover,315,2012,2012,,08-01-20,to-read,to-read (#118),to-read,0
13214,"I Know Why the Caged Bird Sings (Maya Angelou's Autobiography, #1)",Maya Angelou,"Angelou, Maya",,0553279378,9780553279375,0,4.26,Bantam Books,Paperback,289,1993,1969,,08-01-20,to-read,to-read (#117),to-read,0
7126,The Count of Monte Cristo,Alexandre Dumas,"Dumas, Alexandre","David Case, Robin Buss",0140449264,9780140449266,0,4.27,Penguin Classics,Paperback,1276,2003,1844,,08-01-20,to-read,to-read (#116),to-read,0
18114322,The Grapes of Wrath,John Steinbeck,"Steinbeck, John",,067001690X,9780670016907,0,3.98,Viking,Hardcover,479,2014,1939,,08-01-20,to-read,to-read (#115),to-read,0
2956,The Adventures of Huckleberry Finn,Mark Twain,"Twain, Mark","Guy Cardwell, John Seelye, Walter Trier",0142437174,9780142437179,0,3.82,Penguin Classics,Paperback,327,2002,1884,,08-01-20,to-read,to-read (#114),to-read,0
10365,Where the Red Fern Grows,Wilson Rawls,"Rawls, Wilson",,0375806814,9780375806810,5,4.08,Yearling,Mass Market Paperback,272,2000,1961,,08-01-20,,,read,1
43205046,The Nature of Sex: The Ins and Outs of Mating in the Animal Kingdom,Carin Bondar,"Bondar, Carin",,,,5,3.91,Weidenfeld & Nicolson,Kindle Edition,,2015,,,07-01-20,,,read,1
6950520,Am I Making Myself Clear?: A Scientist's Guide to Talking to the Public,Cornelia Dean,"Dean, Cornelia",,0674036352,9780674036352,0,3.44,Harvard University Press,Hardcover,274,2009,2009,,08-01-20,to-read,to-read (#113),to-read,0
39874447,How to Write a Lot: A Practical Guide to Productive Academic Writing,Paul J. Silvia,"Silvia, Paul J.",,1433829738,9781433829734,0,4.06,American Psychological Association (APA),Paperback,145,2018,2007,,08-01-20,to-read,to-read (#112),to-read,0
40910274,The Deep History of Ourselves: The Four-Billion-Year Story of How We Got Conscious Brains,Joseph E. LeDoux,"LeDoux, Joseph E.",,0735223831,9780735223837,0,3.88,Viking,Hardcover,432,2019,2019,,08-01-20,to-read,to-read (#111),to-read,0
23398722,Anxious: Using the Brain to Understand and Treat Fear and Anxiety,Joseph E. LeDoux,"LeDoux, Joseph E.",,0670015334,9780670015337,0,3.52,Viking,Hardcover,480,2015,2015,,08-01-20,to-read,to-read (#110),to-read,0
780672,The Emotional Brain: The Mysterious Underpinnings of Emotional Life,Joseph E. LeDoux,"LeDoux, Joseph E.",,0684836599,9780684836591,0,4.08,Simon  Schuster,Paperback,384,1998,1996,,08-01-20,to-read,to-read (#109),to-read,0
151132,Synaptic Self: How Our Brains Become Who We Are,Joseph E. LeDoux,"LeDoux, Joseph E.",,0142001783,9780142001783,0,3.99,Penguin Books,Paperback,416,2003,2002,,08-01-20,to-read,to-read (#108),to-read,0
18077875,Essentialism: The Disciplined Pursuit of Less,Greg McKeown,"McKeown, Greg",,0804137382,9780804137386,0,4.02,Crown Business,Hardcover,260,2014,2011,,08-01-20,to-read,to-read (#107),to-read,0
18693655,A Mind for Numbers: How to Excel at Math and Science (Even If You Flunked Algebra),Barbara Oakley,"Oakley, Barbara",,039916524X,9780399165245,0,4.18,The Penguin Group,Paperback,336,2014,2014,,08-01-20,to-read,to-read (#105),to-read,0
13400,Molecular Biology of the Cell,Bruce Alberts,"Alberts, Bruce","Alexander Johnson, Julian Lewis, Martin Raff, Keith   Roberts, Paul Walter",0815332181,9780815332183,0,4.35,Garland Science,Hardcover,1616,2002,1983,,08-01-20,to-read,to-read (#104),to-read,0
21944044,Sex on Earth: A Celebration of Animal Reproduction,Jules Howard,"Howard, Jules",,1408193418,9781408193419,5,3.84,Bloomsbury USA,Hardcover,272,2014,2014,,08-01-20,,,read,1
26073146,Death on Earth: Adventures in Evolution and Mortality,Jules Howard,"Howard, Jules",,1472915070,9781472915078,0,3.67,Bloomsbury Sigma,Hardcover,288,2016,2015,,08-01-20,to-read,to-read (#103),to-read,0
35068849,Crash Test Girl: An Unlikely Experiment in Using the Scientific Method to Answer Life's Toughest Questions,Kari Byron,"Byron, Kari",,0062749781,9780062749789,0,3.92,HarperOne,ebook,256,2018,2018,,08-01-20,to-read,to-read (#102),to-read,0
82535,Things I Overheard While Talking to Myself,Alan Alda,"Alda, Alan",,1400066174,9781400066179,0,3.76,Random House (NY),Hardcover,209,2007,2007,,08-01-20,to-read,to-read (#101),to-read,0
40600256,"If I Understood You, Would I Have This Look on My Face?: My Adventures in the Art and Science of Relating and Communicating",Alan Alda,"Alda, Alan",,,,0,3.85,Random House,Kindle Edition,210,2017,2017,,08-01-20,to-read,to-read (#100),to-read,0
25216000,Pain is Really Strange,Steve Haines,"Haines, Steve",,1848192649,9781848192645,0,4.05,Jessica Kingsley Publishers,Paperback,32,2015,2015,,08-01-20,to-read,to-read (#99),to-read,0
37505675,Leapfrog: The New Revolution for Women Entrepreneurs,Nathalie Molina Niño,"Niño, Nathalie Molina","Sara Grace, Kimberly Bryant",0143132202,9780143132202,0,4.39,Tarcherperigee,Paperback,256,2018,2018,,08-01-20,to-read,to-read (#98),to-read,0
1091619,The Uses of the University,Clark Kerr,"Kerr, Clark",,0674005325,9780674005327,0,3.61,Harvard University Press,Paperback,288,2001,1982,,08-01-20,to-read,to-read (#97),to-read,0
18282998,Let's Just Say It Wasn't Pretty,Diane Keaton,"Keaton, Diane",,0812994264,9780812994261,0,2.9,Random House,Hardcover,192,2014,2014,,08-01-20,to-read,to-read (#96),to-read,0
37435,The Secret Life of Bees,Sue Monk Kidd,"Kidd, Sue Monk",,0142001740,9780142001745,0,4.07,Penguin Books,Paperback,302,2003,2001,,08-01-20,to-read,to-read (#95),to-read,0
35133922,Educated,Tara Westover,"Westover, Tara",,,,0,4.46,Random House,Hardcover,334,2018,2018,,08-01-20,to-read,to-read (#94),to-read,0
40591267,"Girl, Stop Apologizing: A Shame-Free Plan for Embracing and Achieving Your Goals",Rachel Hollis,"Hollis, Rachel",,1400209609,9781400209606,0,3.84,HarperCollins Leadership,Hardcover,240,2019,2019,,08-01-20,to-read,to-read (#93),to-read,0
46114266,Successful Aging: A Neuroscientist Explores the Power and Potential of Our Lives,Daniel J. Levitin,"Levitin, Daniel J.",,1524744182,9781524744182,0,3.89,Dutton Books,Hardcover,528,2020,2020,,08-01-20,to-read,to-read (#92),to-read,0
126061,The Double Helix,James D. Watson,"Watson, James D.",,0451037707,9780451037701,0,3.86,Signet Books,Paperback,143,1969,1968,,08-01-20,to-read,to-read (#91),to-read,0
37969630,Poached: Inside the Dark World of Wildlife Trafficking,Rachel Love Nuwer,"Nuwer, Rachel Love",,0306825503,9780306825507,0,4.21,Da Capo Press,Hardcover,384,2018,2018,,08-01-20,to-read,to-read (#90),to-read,0
1319,The War of Art: Winning the Inner Creative Battle,Steven Pressfield,"Pressfield, Steven",Robert McKee,0446691437,9780446691437,0,3.98,Warner Books,Paperback,168,2003,2002,,07-01-20,to-read,to-read (#89),to-read,0
1633,Getting Things Done: The Art of Stress-Free Productivity,David    Allen,"Allen, David",,0142000280,9780142000281,0,3.98,Penguin Group,Paperback,267,2002,2001,,07-01-20,to-read,to-read (#88),to-read,0
968,"The Da Vinci Code (Robert Langdon, #2)",Dan Brown,"Brown, Dan",,,,5,3.88,Anchor,Paperback,489,2006,2003,01-01-06,07-01-20,,,read,1
877693,Don Juan Tenorio,José Zorrilla,"Zorrilla, José",Aniano Peña,8437602130,9788437602134,3,3.65,Cátedra,Paperback,226,2017,1844,01-01-15,07-01-20,,,read,1
38665,Pedro Páramo / El Llano en llamas,Juan Rulfo,"Rulfo, Juan",,9703705774,9788408066439,5,4.29,Planeta,Paperback,290,2006,1955,01-01-15,07-01-20,,,read,1
500400,El amor en los tiempos del cólera,Gabriel García Márquez,"Márquez, Gabriel García",,0307387267,9780307387264,3,3.92,Vintage Español,Paperback,461,2003,1985,01-01-09,07-01-20,,,read,1
23875,El coronel no tiene quien le escriba,Gabriel García Márquez,"Márquez, Gabriel García",,0307350436,9780307350435,5,3.78,Plaza & Janés,Paperback,104,2006,1961,01-01-15,07-01-20,,,read,1
16234587,Letters to a Young Scientist,Edward O. Wilson,"Wilson, Edward O.",,0871403773,9780871403773,5,3.91,Liveright,Hardcover,256,2013,2013,01-01-14,07-01-20,,,read,1
70401,On the Road,Jack Kerouac,"Kerouac, Jack",,0140042598,9780140042597,3,3.62,Penguin Books,Paperback,307,1976,1957,01-01-17,06-01-20,,,read,1
1043247,El olvido que seremos,Héctor Abad Faciolince,"Faciolince, Héctor Abad",,9584215000,9789584215000,4,4.4,Planeta,Paperback,319,2006,2006,01-01-15,06-01-20,,,read,1
40604658,"Jurassic Park (Jurassic Park, #1)",Michael Crichton,"Crichton, Michael",,,,5,4.06,Ballantine Books,Kindle Edition,466,2012,1990,01-01-16,06-01-20,,,read,1
46170,For Whom the Bell Tolls,Ernest Hemingway,"Hemingway, Ernest",,,,4,3.97,Scribner,Paperback,471,1995,1940,01-01-18,06-01-20,,,read,1
17689,Franz Kafka's The Castle (Dramatization),David Fishelson,"Fishelson, David","Aaron Leichter, Max Brod, Franz Kafka",082221900X,9780822219002,4,4.08,Dramatist's Play Service,Paperback,59,2003,2003,01-01-20,06-01-20,,,read,1
16631,Steppenwolf,Hermann Hesse,"Hesse, Hermann",Basil Creighton,0140282580,9780140282580,4,4.13,Penguin,Paperback,256,1999,1927,01-01-15,06-01-20,,,read,1
1290168,Amerika (Kafka Library),Franz Kafka,"Kafka, Franz",,0805209441,9780805209440,5,3.75,Schocken Books,Paperback,298,1996,1927,01-12-19,06-01-20,,,read,1
54209,Ever Since Darwin: Reflections in Natural History,Stephen Jay Gould,"Gould, Stephen Jay",,0393308189,9780393308181,5,4.13,W. W. Norton & Company,Paperback,285,1992,1977,01-09-19,05-01-20,,,read,1
370523,Cien años de soledad,Gabriel García Márquez,"Márquez, Gabriel García",,8420471836,9788420471839,5,4.09,Alfaguara,Hardcover,752,2007,1967,01-01-10,05-01-20,,,read,1
233093,"The Cat in the Hat (The Cat in the Hat, #1)",Dr. Seuss,"Seuss, Dr.",,039480001X,9780394800011,5,4.16,Random House Books for Young Readers,Hardcover,61,1985,1957,01-01-05,05-01-20,,,read,1
24178,Charlotte's Web,E.B. White,"White, E.B.","Garth Williams, Rosemary Wells",0064410935,9780064410939,4,4.18,HarperCollinsPublishers,Paperback,184,2001,1952,01-01-02,05-01-20,,,read,1
56899,Aura,Carlos Fuentes,"Fuentes, Carlos",,9580469717,9789580469711,4,3.81,Grupo Editorial Norma,Paperback,65,2004,1962,01-01-15,05-01-20,,,read,1
38787,Pedro Páramo,Juan Rulfo,"Rulfo, Juan","Margaret Sayers Peden, Susan Sontag",0802133908,9780802133908,5,4.06,Grove Press,Paperback,128,1994,1955,01-01-15,05-01-20,,,read,1
24790,Paula,Isabel Allende,"Allende, Isabel",,849759388X,9788497593885,2,4.13,Nuevas Ediciones de Bolsillo,Pasta blanda,432,2004,1994,01-01-07,05-01-20,,,read,1
1665698,La resistencia,Ernesto Sabato,"Sabato, Ernesto",,9507312609,9789507312601,4,3.91,Editorial Seix Barral,Paperback,148,2000,2000,01-01-11,05-01-20,,,read,1
73724,Leyendas de Guatemala,Miguel Ángel Asturias,"Asturias, Miguel Ángel",,8420658774,9788420658773,5,3.55,Alianza Editorial Sa,Paperback,210,2005,1930,01-01-08,05-01-20,,,read,1
172492,Don Quijote de la Mancha (Edición para secundaria),Miguel de Cervantes Saavedra,"Saavedra, Miguel de Cervantes","Milagros Rodríguez Cáceres, José Saramago",9587043111,9789587043112,5,3.88,Alfaguara,Paperback,400,2005,1615,01-01-10,05-01-20,,,read,1
6793898,Carazamba,Virgilio Rodríguez Macal,"Macal, Virgilio Rodríguez",,9992210311,9789992210314,5,4.08,Piedra Santa Editorial,Paperback,208,1953,1953,01-01-15,05-01-20,,,read,1
8041346,El Mundo Del Misterio Verde,Virgilio Rodríguez Macal,"Macal, Virgilio Rodríguez",,8483770725,9788483770726,5,3.78,Editorial Piedra Santa,,242,1991,1991,01-01-15,05-01-20,,,read,1
5835217,La Mansión del Pájaro Serpiente,Virgilio Rodríguez Macal,"Macal, Virgilio Rodríguez",,9992250852,9789992250853,5,3.96,Editorial Piedra Santa,Paperback,145,,,01-01-15,05-01-20,,,read,1
48855,The Diary of a Young Girl,Anne Frank,"Frank, Anne","Eleanor Roosevelt, Barbara Mooyaart-Doubleday",,,5,4.17,Bantam,Mass Market Paperback,283,1993,1947,01-01-06,05-01-20,,,read,1
4146586,The Trial: A Graphic Novel,David Zane Mairowitz,"Mairowitz, David Zane","Franz Kafka, Chantal Montellier",1411415914,9781411415911,5,3.6,Sterling,Paperback,119,2008,2008,01-01-19,05-01-20,,,read,1
50398,Northanger Abbey,Jane Austen,"Austen, Jane",Alfred Mac Adam,1593082649,9781593082642,4,3.84,Barnes & Noble Classics,Paperback,260,2005,1817,01-01-19,05-01-20,,,read,1
6324090,"Alice's Adventures in Wonderland (Alice's Adventures in Wonderland, #1)",Lewis Carroll,"Carroll, Lewis","Antoni Marianowicz, Παυλίνα Παμπούδη",,,5,3.98,Public Domain Books,Kindle Edition,96,1997,1865,01-01-17,05-01-20,,,read,1
157993,The Little Prince,Antoine de Saint-Exupéry,"Saint-Exupéry, Antoine de",Richard Howard,,,5,4.31,"Harcourt, Inc.",Paperback,96,2000,1943,01-01-08,05-01-20,,,read,1
141565,This Is Your Brain on Music: The Science of a Human Obsession,Daniel J. Levitin,"Levitin, Daniel J.",,0525949690,9780525949695,4,3.87,Dutton Adult,Hardcover,314,2006,2006,01-01-15,05-01-20,,,read,1
248787,The World Without Us,Alan Weisman,"Weisman, Alan",,,,4,3.8,Thomas Dunne Books,Hardcover,324,2007,2007,01-01-14,05-01-20,,,read,1
14743,The God Delusion,Richard Dawkins,"Dawkins, Richard",,0618680004,9780618680009,5,3.89,Houghton Mifflin Co. (Boston/NY),Hardcover,374,2006,2006,01-01-14,05-01-20,,,read,1
6117055,The Greatest Show on Earth: The Evidence for Evolution,Richard Dawkins,"Dawkins, Richard",,059306173X,9780593061732,5,4.14,Bantam Press,Hardcover,470,2009,2009,01-01-14,05-01-20,,,read,1
22463,The Origin of Species,Charles Darwin,"Darwin, Charles",,,,3,3.98,Castle Books,Hardcover,703,2004,1859,01-01-10,05-01-20,,,read,1
61535,The Selfish Gene,Richard Dawkins,"Dawkins, Richard",,0199291152,9780199291151,5,4.14,"Oxford University Press, USA",Paperback,360,2006,1976,01-01-12,05-01-20,,,read,1
3869,A Brief History of Time,Stephen Hawking,"Hawking, Stephen",,0553380168,9780553380163,5,4.19,Bantam Books,Paperback,212,1998,1988,01-01-10,05-01-20,,,read,1
2998,The Secret Garden,Frances Hodgson Burnett,"Burnett, Frances Hodgson",,0517189607,9780517189603,4,4.14,Children's Classics,Hardcover,331,1998,1910,01-01-06,05-01-20,,,read,1
3636,"The Giver (The Giver, #1)",Lois Lowry,"Lowry, Lois",,0385732554,9780385732550,4,4.13,Ember,Paperback,208,2006,1993,01-01-04,05-01-20,,,read,1
890,Of Mice and Men,John Steinbeck,"Steinbeck, John",,0142000671,9780142000670,4,3.88,Penguin Books,Paperback,112,2002,1937,01-01-13,05-01-20,,,read,1
5107,The Catcher in the Rye,J.D. Salinger,"Salinger, J.D.",,0316769177,9780316769174,4,3.81,Back Bay Books,Paperback,277,2001,1951,01-01-18,05-01-20,,,read,1
960,"Angels & Demons (Robert Langdon, #1)",Dan Brown,"Brown, Dan",,1416524797,9781416524793,4,3.92,Pocket Books,Mass Market Paperback,736,2006,2000,01-01-04,05-01-20,,,read,1
6900,Tuesdays with Morrie,Mitch Albom,"Albom, Mitch",,0751529818,9780751529814,5,4.13,Warner,Paperback,210,2000,1997,01-01-08,05-01-20,,,read,1
1845,Into the Wild,Jon Krakauer,"Krakauer, Jon",,0385486804,9780385486804,5,4,Anchor Books,Paperback,207,1997,1996,01-01-10,05-01-20,,,read,1
638918,Feminism Confronts Technology,Judy Wajcman,"Wajcman, Judy",,0271008024,9780271008028,0,4.04,Penn State University Press,Paperback,194,1991,1991,,07-01-20,to-read,to-read (#86),to-read,0
9738496,De viaje por los países socialistas,Gabriel García Márquez,"Márquez, Gabriel García",,9580600406,9789580600404,0,4.08,,,150,,,,07-01-20,to-read,to-read (#85),to-read,0
1005549,How to Lie with Maps,Mark Monmonier,"Monmonier, Mark",,0226534219,9780226534213,0,3.6,University of Chicago Press,Paperback,207,1996,1991,,07-01-20,to-read,to-read (#84),to-read,0
3106009,"Rock, Paper, Scissors: Game Theory in Everyday Life",Len Fisher,"Fisher, Len",,0465009387,9780465009381,0,3.41,Basic Books,Paperback,288,2008,2000,,07-01-20,to-read,to-read (#83),to-read,0
